,abstract
0,daya tarik jumpa kota bandung wisatawan wisatawan domestik mancanegara kota bandung salah perusahaanperusahaan produksi jasa berlombalomba layan wisatawan salah akal cahaya media usaha gerak bidang produksi jasa salah barang produksi peta wisata belanja bandung pwbb peta harap manfaat wisatawan informasi tempattempat wisata pwbb sarana wisatawan hemat libur tulis angkat tema fungsi peta produksi ptacm sumber informasi wisatawan laksana tulis staf sirkulasi majalah karirup pwbb tulis tugas tulis menitikberatkan bahas proses produksi pwbb tulis pwbb milik peran bantu wisatawan tulis sumber informasi tempattempat pwbb ciri khas beda pwbb fokus informasi tempattempat wisata belanja distribusi tempattempat kunjung wisatawan perusahaanperusahaan bekerjasama pwbb didistribsikan tempattempat transportasi
1,skripsi judul analisis gairaigo blog kuliner jepang skripsi isi rangkai analisis proses bentuk jenis gairaigo blog kuliner jepang skripsi tuju deskripsi proses bentuk nemenukan jenis gairaigo blog httpsdoanythingnet bidang kuliner analisis muncul tulis metode analisis deskriptif metode kumpul data metode simak teknik simak bebas libat cakap tulis simak catat gairaigo bidang kuliner muncul blog metode analisis data tulis metode padan metode translasional alat langue simpul tulis skripsi proses bentuk alami gairaigo bidang kuliner afiksasi penggabungancompounding pemenggalanclipping peminjamanborrowing data masuk jenis gairaigo singkat bahasa asing data sufiks bahasa jepang morfem bahasa asing data gabung data gairaigo serap langsung data
2,bahasa komunikasi manusia muka bumi bahasa erti orang bahasa lisan tulis formal informal bahasa laku tindak bahasa mitra lawan bicara tangkap maksud bahasa tindak tindak rupa ilmu pragmatik tindak rupa kalimat nyata maksud bicara lawan bicara tindak utama lokusi ilokusi lokusi masingmasing pilar utama milik fungsi laku mudah erti lawan bicara teliti tuju papar bentukbentuk tindak strategi keluh buah karya animasi jepang teliti metode deskriptif kualitatif teliti tuturantuturan data data teliti anime judul tanaka itsumo kedaruge anime keluh sumber teliti analisis data laku klasifikasi bentuk tindak strategi keluh teori hasil teliti temu bentuk tindak data bentuk tindak langsung kategori kalimat berita declarative data kalimat interrogative data bentuk tindak langsung data data keluh temu data keluh implisit kategori isyarat hint data kekesalanketidaksetujuan kategori kesal nance data konsekuensi sakit consequences data tuduh kategori tuduh langsung direct accusation data salah eksplisit sikap explicit blame behavior data
3,lapor susun dasar hasil praktik kerja seharihari mulya meisou bandung tulis kerja staff marketing lapor tugas tulis angkat tema proses seleksi magang mulya meisou bandung teknik susun lapor tulis metode dekriptif metode gambar susun sistematis aktual faktual sistematik baca tulis laku langsung lapang kumpul data usaha wawancara salah staff mulya meisou bandung kait tema lapor kerja tulis tugas tanggung berkasberkas magang promosi program magang tawar usaha manfaat tugas akkhir tulis alur daftar usaha rekrut magang
4,praktik kerja lapang salah syarat akademik selesai didik diploma program studi bahasa jepang fakultas bahasa universitas widyatama tulis laksana praktik kerja lapang dinas pariwisata budaya provinsi jawa barat hitung tanggal desember januari dinas pariwisata budaya provinsi jawa barat lokasi jlllremartadinata bandung tuju praktik kerja lapang giat promosi pariwisata laku dinas pariwisata budaya provinsi jawa barat tarik kunjung wisatawan wisata jawa barat metode tugas metode deskriptif gambar susun sistematis aktual cermat tulis laku langsung lapang kumpul data usaha sangkut laku wawancara langsung staf kepala bidang pasar dinas pariwisata budaya provinsi jawa barat laksana praktik kerja tulis promosi tulis laku giat evaluasi data artikel menginput kait pariwisata nama dinas dinas pariwisata jawa barat daftar hotel daftar pariwisata biro travel bandung tulis laku kunjung monumen juang monju promosi pariwisata laku dinas pariwisata budaya provinsi jawa barat event keikutsertaan event promosi media cetak elektronik media ruang tourist information center laku kerjasama bentuk badan promosi pariwisata tarik kunjung wisatawan jepang informasi sedia pandu wisatawan jepang infrastruktur bersih agam atraksi segi kuliner transportasi tunjang lapor harap informasi mahasiswa universitas widyatama tarik dunia pariwisata harap data informasi dinas pariwisata budaya provinsi jawa barat
5,didik rupa hidup tulis pikir hidup manusia ajar ajar laku ruang kelas bias laku sekolah alam seharihari salah didik lapang wisata edukasi hasmilk milik koperasi ternak sapi gunung gede sukabumi tulis laku praktik kerja lapang usaha tanggal maret april dasar alam tulis susun lapor dasar peran wisata didik lapang usaha susu gunung gede angkat tema peran wisata edukasi hasmilk koperasi ternak sapi gunung gede usaha susu sapisapi pelihara susu produksi rupa lihat anakanak kota buah wisata rupa pikir jual produk usaha kunjung caracara pelihara sapi caracara produk usaha susu informasi informasi sederhana mudah erti kunjung rupa anakanak ajar senang main tulis laku kerja praktik lapang pandu guide tugas utama pandu anakanak rupa kerja tarik senang didik manfaat anakanak selagi main halhal masyarakat luas anakanak halhal milik ajar giat usaha keras jaga alam wisata didik tulis ajar bermacammacam praktik singkat manfaat dunia kerja sungguh
6,praktik kerja lapang salah syarat selesai didik program diploma program studi bahasa jepang fakultas bahasa universitas widyatama tuju praktik kerja lapang mahasiswa praktikan ilmu ajar bangku kuliah hasil laksana praktik kerja tulis tuang tulis bentuk lapor laksana praktik kerja tulis laksana tanggal pebruari maret citra sarana bahasa informatika csbi alamat pahlawan bandung jawa barat telpfax csbi rupa kursus orang kembang salah program latih adakan laksana praktik kerja tulis asisten ajar tugas description ajar csbi ajar biodata siswasiswi tuju siswa bimbing ajar ajar silabus kurikulum tata bimbing ajar praktik ajar siswa siswi bimbing sensei ajar resmi csbi ajar uji bahasa jepang laksana praktik kerja tulis alam harga kena dunia kerja sungguh dunia ajar ajar tulis sadar tugas orang ajar materi ajar dorong semangat murid tarik subjek ajar langsung dorong kembang tulis sadar manfaat ajar bahasa asing lapis masyarakat bahasa faktor tunjang tingkat nilai jual nilai saing bargaining point globalisasi orangorang ajar bahasa cenderung kreatif lihai pecah soalsoal kompleks kuasa bahasa peran dunia kerja kembang tingkat bahasa asing tulis harap alam tulis laksana praktik kerja lapang manfaat tulis khusus baca
7,jepang salah negara budaya milik minat negara dunia indonesia salah negara masyarakat suka budaya jepang tingkat minat berita jepang budaya tingkat iring kembang teknologi masyarakat mudah cari berita informasi internet media massa digital jumpa bentuk website blog berita informasi media sosial facebook twitter instagram laku masyarakat mudah cepat akses informasi aktual lapor tugas tulis angkat judul proses olah artikel situs japanese station teknik susun lapor tulis metode deskriptif gambar susun sistematis aktual faktual tulis laku langsung lapang kumpul data diskusi staf japanese station kait tulis lapor hasil praktik kerja lapang tulis simpul meta keyword tags internal link external link poinpoin artikel website bahas artikel judul summary gambar tarik tarik minat baca proses olah artikel teliti perhati hadap detail hindar salah
8,bandung kenal pariwisata gunung indah salah kawasan punclut kawasan punclut kenal kawasan rekreasai wisata alami minggu pagi sore orang dating rekreasi kawasan ramai kenal orang kawasan punclut kawasan pariwisata mudah kendala debat kawasan punclut kawasan resap kawasan rusak kikis tanah pergesaran tanah timbul bencana alam biar sayang siasia lapor tugas isi saran perintah kota bandung harap milik pikir kena rencana tata bangun kawasan punclut kota bandung wisata
9,majas sindir gaya bahasa sindir orang karya sastra majas manfaat kaya bahasa karya sastra hidup buah lagu nikmat nada irama sarana pesan dengar majas sindir lagu tulis lagu kritik saran sindir orang liriklirik lagu teliti tuju papar jenisjenis majas sindir makna majas sindir lirik lagu teliti metode deskriptif kualitatif gambar situasi analisis data data lagu jepang inochi kirawareteiru lagu viral media sosial hubung animemanga analisis data laku identifikasi makna sindir temu semantik suai data chaer jenis majas sindir waridah fitri ratna erti majas sindir aminuddin kaf waluyo teliti temu data sindir majas sindir majas ironi majas sinisme majas sarkasme majas sindir majas satire majas innuendo
10,tulis laksana sora japanese language institute laksana hitung tanggal januari april sora lokasi cigadung koa coblong kota bandung jawa barat tuju praktik kerja lapang jenis konten gemar akun instagram sora alas akun instagram sora suka konten sora tarik akun instagram sora gabung sora tulis metode deskriptif metode lapor langsung lapang kumpul data akun instagram sora data tulis data post konten pembelajaraan sora februariapril simpul tulis tugas konten ajar goonlah gemar akun instagram sora alas responden suka konten ajar goon materi konten tarik manfaat dasar jenis kelamin usia kerja mayoritas responden pilih alas status mahasiswa rentang usia orang lakilaki orang perempuan lihat akun instagram sora resoponden tarik gabung sora dasar jenis kelamin usia kerja responden tanggap tarik gabung sora lakilaki rentang usia status mahasiswa
11,teliti angkat tema analisis kanji jukujikun manga kimetsu yaiba tuju teliti deskripsi proses bentuk kanji jukujikun manga kimetsu yaiba deskripsi hubung makna bentuk kanji jukujikun manga kimetsu yaiba manga kimetsu yaiba volume data teori proses bentuk kanji jukujikun teori todo teori hubung makna bentuk kanji jukujikun teori tsuchiya jenis teliti deskriptif kualitatif metode kumpul data teliti metode simak teknik catat metode analisis data metode padan referensial metode saji hasil analisis data metode saji informal hasil teliti nyata data lihat proses bentuk data hubung meri data hubung tara data hubung data hubung subjek predikat lihat hubung makna bentuk dasar gabung kanji masuk struktur data masuk struktur data dasar gabung kanji masuk struktur data masuk struktur data
12,syarat tempuh uji lulus bahasa jepang universitas widyatama program diploma tulis laksana praktik kerja lapang dinas pariwisata bandung jalan jendral ahmad yani bandung jawa barat indonesia tulis laksana praktik kerja lapang sesuai laku universitas widyatama kisar tanggal maret laksana praktik kerja tulis pasar tugas promosi kota bandung giat tulis kerja surat izin rekomendasi data surat masuk sedia brosur kunjung alas tulis pilih judul pengaruh wisata kuliner hadap pariwisata bandung data dinas budaya pariwisata tulis tarik orang wisata kuliner rela tempuh jarak rela rogoh kocek cicip masakan tulis wisatawan kadang suka bandung tugas tulis batas unggul wisata kuliner bandung khas wisata kuliner tarik kunjung wisatawan pengaruh timbul wisata kuliner hadap pariwisata bandung makan suka orang wisata kuliner surabi colenak peuyeum batagor bandung makan kenal wisata kuliner bandung kunjung orangorang sekian lapor
13,makan rupa butuh pokok makhluk hidup tahan hidup makan manusia tahan manusia urut rantai makan manusia lihat makan isi perut tahan hidup iring jalan makan ubah dar isi perut buah giat undang selera globalisasi pengaruh aspek dunia masuk makan indonesia salah negara kena dampak globalisasi negara salah negara jepang muncul restoran khas jepang restoran pasu menu makan jepang daftar menu
14,tugas praktik laku syarat akademik selesai program studi diploma bahasa jepang fakultas bahasa universitas widyatama tulis laksana praktik kerja museum geologi bandung lokasi diponegoro bandung laksana tanggal februari tanggal juni laksana praktik kerja lapang museum geologi tulis front office tugas informasi butuh kunjung hitung kunjung brosur kunjung reservasi pandu kunjung museum geologi rupa salah fungsi sumber ilmu rupa data benda informasi aspek bumi liput sejarah hidup muka bumi geologi indonesia geologi hidup manusia museum geologi bandung museum bantu masyarakat ilmu geologiyang ilmu jumpa hidup seharihari sadar peran museum geologi dasar tulis lapor judul peran museum geologi salah ilmu geologi hadap masyarakat bandung
15,lapor susun dasar hasil praktik kerja lapang tulis program studi bahasa jepang universitas widyatama tulis laksana kerja bimbing hety nurohmah mhum tugas admin media sosial instagram facebook tiktok youtube rupa milik prodi tulis konten kreator isi unggah materi hubung kejepangan prodi akun media sosial tulis pilih tema efektivitas ajar bahasa jepang video singkat media sosial lapor tugas tingkat efektivitas ajar bahasa jepang video pendek media sosial tulis kemas konten suka audiens konten kreator pikir matangmatang langkah unggah konten media sosial teknis susun lapor tugas tulis metode survei deskriptif metode teliti ambil sampel populasi kuesioner alat kumpul data wasito metode teliti tulis kuesioner sebar responden data informasi relevan data tulis papar deskriptif teliti analisis gambar faktafakta sifat hubung gejala teliti tulis harap lapor tugas manfaat konten kreator terjun bahas bahasa jepang media sosial manfaat kelola admin media sosial program studi bahasa jepang universitas widyatama
16,bandung rupa salah kota jawa barat kreatif cenderamata unik khas kota bandung bandung rupa kota belanja padat wisatawan kota bandung belanja outlet bandung gemar anak muda bandung okitawa produksi buah tshirt cenderamata wisatawan asing domestik kunjung bandung kunjung outlet okitawa tshirt produksi okitawa khas desain sudut kota kenal bandung gedung sate gedung merdeka jembatan pasupati lihat latar tulis angkat tema promosi okitawa tshirt desain bandung tingkat wisatawan kota bandung tuju wisatawan suka produk tshirt desain bandung kualitas produksi minat wisatawan tulis laksana kuliah praktik kerja okitawa lokasi jalan irhaji juanda kurun tulis universitas widyatama hitung tanggal desember desember giat laku tulis laku data ulang barang produksi okitawa jual laku transaksi jual barang laku tutup jual hitung benda catat faktur beli lihat hasil jual barang desain suka konsumen produk okitawa pakai umur wisatawan kunjung okitawa agam jepang malaysia singapura prancis india belanda amerika kanada australia wisatawan domestik yogyakarta jakarta surabaya suka bahan bahan dasar pakai katun kombad nyaman pakai desain gambar sudut kota bandung kenal padu gambar otomotif tulis bandung
17,teliti judul analisis alih kode lirik lagu better still here karya ateez boygrup korea tuju teliti deskripsi bentuk alih kode lirik lagu salur youtube ateez tulis sumber data lagu salur youtube ateez data teliti metode teliti metode kualitatif deskriptif tahap tahap kumpul data tahap analisis data tahap saji hasil analisis data metode teknik kumpul data metode simak teknik simak bebas libat cakap metode teknik analisis data metode padan translasional teknik pilah unsur metode saji hasil analisis data metode saji formal hasil teliti nyata data alih kode eksternal data alih kode bahasa jepang bahasa inggris data alih kode bahasa inggris bahasa jepang data
18,indonesia rupa negara pulau milik potensi wisata kembang milik unggul kaya alam ragam budaya banding negara sadar potensi wisata kaya peran pariwisata ekonomi indonesia perintah tekad kembang pariwisata salah industri hasil devisa negara dukung kembang pariwisata perintah jawa barat kerja dinas budaya pariwisata jawa barat giat pasanggiri mojang jajaka jawa barat tuju tingkat apresiasi generasi muda hadap nilai nilai seni budaya peran aktif promosi pariwisata daerah khusus jawa barat lapor kerja praktek bahas kena pasanggiri mojang jajaka jawa barat proses pasanggiri mojang jajaka jawa barat duta pariwisata tugas mojang jajaka duta pariwisata jawa barat giat pasanggiri mojang jajaka jawa barat rupa salah usaha tumbuh sadar wisata peduli sosial cinta tanah kalang generasi muda salah kunci hasil kembang pariwisata masyarakat partisipasi aktif kembang budaya pariwisata pasanggiri mojang jajaka jawa barat anggap salah usaha kembang pariwisata jawa barat rupa event kembang budaya
19,tugas praktik kerja laku prasyarat lulus universitas widyatama fakultas bahasa program studi bahasa jepang tulis laku praktik kerja dishubparpostel lokasi veteran purwakarta kerja praktik laku hitung tanggal januari tanggal maret pokok bahas tugas fokus kabupaten purwakarta milik pariwisata tarik wisatawan asing potensi pariwisata kabupaten purwakarta tarik wisatawan asing khusus wisatawan jepang kabupaten purwakarta praktik kerja lapang tulis administrasi bidang budaya giat tulis laku laksana praktik kerja lapang catat masuk surat masuk bidang budaya kumpul data butuh masyarakat purwakarta sebar informasi masyarakat senggang tulis lihat arsip arsip budaya pariwisata dishubparpostel paham informasi giat laku pegawai dishubparpostel observasi budaya pariwisata contoh terjun langsung tempattempat pariwisata pantau langsung kunjung wisata periksa fasilitas wisata cari padan bahasa jepang wawas objek wisata kabupaten purwakarta liput objek wisata alam objek wisata gedung sejarah objek wisata kuliner objek wisata kriya objek objek wisata potensi hadap wisatawan asing khusus wisatawan jepang orang jepang suka pergi tempattempat pariwisata potensi alam bagus utama tempattempat senang laku hasil metode survei wawancara objek wisata kabupaten purwakarta benah kembang harap tarik wisatawan asing khusus wisatawan jepang income perintah daerah kabupaten purwakarta kabupaten purwakarta kenal mancanegara
20,tugas tulis angkat judul latih magang jepang lembaga latih kerja koperasi kulak mitra paku ardin jawa barat tugas tulis papar magang proses saring tulis papar ajar bahasa jepang beda ajar magang mahasiswa motivasi kendala latih ardin jabar laksana praktik kerja tulis ajar bahasa jepang awas tulis lapor minggu kelas bantu kumpul dokumen awas asrama hasil telaah tulis simpul program latih bekal magang jepang latar angka anggur sakit butuh ekonomi sulit cari kerja indonesia dampak postif magang jepang tingkat anggur efek kontribusi signifikan tekan dampak krisis ekonomi global tingkat devisit negara tingkat masyarakat
21,teliti judul analisis nazonazo film animasi detektif conan bahas main nazonazo muncul film animasi detektif conan tuju identifikasi nazonazo proses bentuk klasifikasi jenis main nazonazo rupa salah jenis main temu hidup seharihari bentuk tebaktebakan bahasa indonesia nazonazo rupa main metode pakai teliti metode simak teknik simak bebas libat cakap subjek teliti rupa video akses laman internet sedia layan streaming basis langgan teori muncul cakup teori main nazonazo dajare goroawase anagram simpul nazonazo film animasi detektif conan bentuk dajare bentuk goroawase bentuk anagram bentuk
22,tugas praktik kerja laku prasyarat lulus universitas widyatama fakultas bahasa program studi tulis laku kerja praktik restoran tonijacks indonesia bandung indah plaza lokasi merdeka bandung kerja praktik laku hitung tanggal desember tanggal desember praktik kerja lapang tulis caf tonijacks indonesia bandung indah plaza giat tulis laku laksana praktik kerja orang front liner counter layan pesan kunjung restoran tonijacks indonesia bandung indah plaza tanggal oktober mcdonalds bandung indah plaza ganti nama tonijacks indonesia restoran tonijacks indonesia bandung indah plaza kurun alam turun kunjung pakai bahasa asing restoran tonijacks indonesia restoran tahan pokok bahas tugas fokus pengaruh brand hadap kunjung konsumen khusus orang asing orang front liner tugas sambut produk tawar harap mengkomunikasikan produkproduk brand khusus konsumen orang asing pengaruh bahasa asing komunikasi bantu tingkat kualitas restoran tonijacks indonesia bandung indah plaza brand tarik minat konsumen khusus orang asing service konsumen asing segi kuasa bahasa asing batas sapa selamat selamat pagi bantu puas pengaruh restoran tonijacks indonesia bandung indah plaza bahasa asing kuasa karyawan tonijacks indonesia bandung indah plaza brand pengaruh hadap kunjung konsumen khusus orang asing laksana kerja praktik tulis awas manager masingmasing departemen karyawan restoran tonijacks indonesia bandung indah plaza prima service milik bahasa asing
23,teliti judul analisis alih kode campur kode video jerome polin salur youtube nihongo mantappu kaji sosiolinguistik tuju teliti identifikasi bentuk alih kode campur kode video jerome polin salur youtube nihongo mantappu teliti tulis video jerome polin salur youtube nihongo mantappu data teliti teori alih kode teori hoffman teori campur kode teori muysken metode teliti metode kualitatif deskriptif tahap tahap kumpul data tahap analisis data tahap saji hasil analisis data metode teknik kumpul data metode simak teknik simak bebas libat cakap teknik catat metode teknik analisis data metode padan intralingual teknik pilah unsur metode saji hasil analisis data metode saji informal hasil teliti nyata jenis alih kode intersentential data intra sentential data emblematic switching data jenis campur kode sisip data alternasi data leksikal kongruen data
24,praktik kerja lapang salah syarat selesai didik program diploma program studi bahasa jepang fakultas bahasa universitas widyatama tuju praktik kerja lapang mahasiswa praktikan ilmu ajar ban kuliah hasil laksana praktik kerja tulis tuang tulis bentuk lapor laksana praktik kerja tulis laksana tanggal februari maret citra sarana bahasa informatika csbi alamat pahlawan bandung jawa barat indonesia citra sarana bahasa informatika csbi rupa lembaga bimbing ajar bahasa asing informatika laksana praktik kerja tulis ajar bahasa jepang tulis latih caracara ajar bahasa jepang kelas proses ajar kelas tulis ajar bahasa jepang kelas tulis data siswa kena alasanalasan ajar bahasa asing latar tuju siswa ajar bahasa asing csbi berbedabeda utama lihat segi usia siswa usia anakanak ajar bahasa karen suruh orang tua isi luang suka film lagu bahasa asing siswa usia remaja ajar bahasa asing tuju didik kerja rencana sekolah negri kerja negri siswa usia dewasa milik tuju kerja ajar bahasa asing laksana praktik kerja tulis alam sistematika ajar bahasa asing sesuai butuh siswa sikap materi hadap golong usia beda terap proses ajar bahasa asing siswa kelas milik golong usia beda tulis hati ajar bahasa asing saran materi kreatif interaksi kelas siswa beda tuju usia siswa mudah serap materi tulis harap alam tulis laksana praktik kerja lapang manfaat tulis khusus baca
25,dinas pariwisata budaya kabupaten garut tugas kelola kembang potensi wisata milik kabupaten garut salah usaha laku dinas pariwisata budaya kabupaten garut laku promosi pariwisata media sosial instagram nama akun dispar garut promosi pariwisata media sosial rupa salah usaha laku promosi pariwisata utama lembagalembaga gelut bidang pariwisata jnto japan national tourism organization nama akun visitjapanjp rupa lembaga pariwisata jepang milik tuju promosi pariwisata jepang teliti bahas akun dispar garut visitjapanjp promosi pariwisata media sosial instagram data rupa data screenshot akun dispar garut visitjapanjp fokus teliti dispar garut visitjapanjp manfaat platform media sosial instagram usaha promosi digital pariwisata beda akun instagram dispar garut visitjapanjp promosi destinasi wisata metode teliti laku teliti metode kualitatif teliti usaha temu beda milik dispar garut visitjapanjp hasil teliti beda akun dispar garut visitjapanjp akun temu tuju promosi modifikasi tuju promosi bujuk jenis konten pariwisata background music beda akun beda bahasa gaya khas masingmasing akun
26,penuh syarat lulus akademik program diploma fakultas bahasa program studi bahasa jepang universitas widyatama salah mahasiswa laksana praktek kerja lapang susun lapor praktek kerja tulis laksana praktik kerja lapang laksana maret april excellent holidays tour travel jlwr supratman bandung jawa barat indonesia excellent holidays tour travel bandung salah usaha buka layan wisatawan laku jalan wisata bisnis sedia paket libur domestic negeri airticket dokumen jalan pandu wisata lainlain tulis angkat tema lapor praktik kerja layan jasa travel wisatawan laku bisnis excellent holidays tour travel bandung laksana praktik kerja tulis domestik divisi tugas layan konsumen pesan tiket tiket domestic ticket data konsumen layan invoice bukti bayar kerja kerja alat kantor scan copy telefon masuk menterjemahkan packing tour travel bahasa inggris bahasa jepang kirim packing tour travel excellent holidays email traveltravel jepang laksana praktik kerja tulis kena dunia bisnis dunia kerja sungguh tulis excellent holidays tawar paketpaket tour wisata bisnis tarik wisatawan layan jasa mudah puas wisatawan laku bisnis segi fasilitas layan jalan wisata bisnis tulis reservasi pesawat sistem reservasi excellent holidays tour travel biro jalan wisata tour travel milik peran dunia pariwisata rupa salah ujung tombak kembang dunia pariwisata wisatawan asing masuk wisata samping devisa negara tulis harap alam tulis laksana praktik kerja lapang manfaat tulis khusus baca
27,teliti tuju deskripsi jenis majas lirik lagu indonesia terjemah versi bahasa jepang lirik lagu rupa salah jenis karya sastra kandung jenis majas makna majas rupa buah ekspresi pikir pilih sirat metode kumpul data teliti metode simak teknik catat metode analisis data metode referensial teknik dasar bilah unsur sumber data rupa lirik lagu indonesia judul kepompong indah terjemah versi jepang hiroaki kato hasil teliti rupa jenis majas lirik lagu kepompong jenis majas simile personifikasi metafora antitesis hiperbola repetisi majas dominan lirik lagu simile lirik lagu indah jenis majas personifikasi metafora hiperbola paralelisme pleonasme majas dominan lirik lagu hiperbola
