,abstract
57,jepang masuk salah negara sorot warga dunia khusus didik jepang indonesia minat hadap bahasa jepang tingkat perusahaanproduk jasa bantu siswa informasi kena sekolahsekolah jepang bantu sekolah jepang tingkat tulis laksana praktik kerja lapang studi jepang letak ruko bengawan lantai jalan bengawan bandung hitung tanggal januari februari tuju praktik kerja lapang kembang siswa studi jepang tingkat turun siswa tulis metode deskriptif tulis tugas metode lapor langsung lapang kumpul data usaha laksana praktik kerja lapang tulis tugas promosi studi jepang sosial media blog pribadi praktik kerja lapang tulis simpul siswa program jangka long course berangkat april oktober alam tingkat siswa program jangka pendek short course berangkat maret agustus alam tingkat turun alas kena tingkat siswa program jangka minat ajar bahasa budaya jepang indonesia tingkat alas kena turun siswa program jangka pendek pilih program jangka
58,lapor tugas rupa salah syarat tempuh lulus mahasiswa program bahasa jepang program diploma universitas widyatama tulis laksana praktik kerja lapang dinas pariwisata budaya bandung provinsi jawa barat unit balai kelola purbakala sejarah nilai tradisional jalan pati ukur bandung tulis laksana praktik kerja lapang sesuai laku prodi bahasa jepang praktek kerja lapang laksana januari tanggal maret kerja tugas tulis angkat tema upaya pelihara benda cagar budaya tinggal sejarah data balai pengelolalan purbakala sejarah nilai tradisional tugas tulis batas upaya pelihara benda cagar budaya laku balai kelola purbakala sejarah nilai tradisional benda cagar budaya jaga bentuk ukur keaslinnya pecah hadap laksana praktik kerja tulis jabat fungsional pamong budaya tugas cari benda cagar budaya datadatanya fakta giat tulis kerja cari datadata sejarah benda cagar budaya pasu datadata sejarah sumber data usaha damping orangorang laku kunjung museum purbakala kantor balai kelola purbakala sejarah nilai tradisional hasil telaah tulis simpul pelihara rupa salah usaha lestari benda cagar budaya laku sinambung sistem sederhana sistem modern pelihara situs laksana pelihara tradisional juru pelihara laksana pelihara tradisional metode pelihara liput konservasi rehabilitasi benda cagar budaya umur bepuluhpuluh lihat bentuk ukur asli atapun ilmu sejarah manfaat masyarakat golong ditambahkanya sumber daya manusia juru pelihara sesuai situs latih pelihara benda cagar budaya pemeliharann benda cagar budaya maksimal rawat
59,campur kode alih kode peristiwa alih campur bahasa milik bahasa teliti tuju klasifikasi bentuk campur kode alih kode album unlock album unlock milik lagu bahasa jepang jenis teliti metode deskriptif kualitatif analisis sblc simak bebas libat cakap metode libat tulis teliti dar metode analisis padan referensial padan translasional hasil teliti bentuk campur kode alih kode frasa klausa bentuk alih kode alih kode kalimat
60,salah negara maju kawasan asia jepang milik butuh tenaga kerja kerja laku program kirim tenaga kerja sektor masuk kuliner salah upaya dukung kualitas calon tenaga kerja penuh kualifikasi paham dasar kait aspek sektor tuju kerja tata layan langgan rupa sektor kuliner metode kualitatif komparatif teliti hasil hidden farm plantshop caf rupa restoran jenis kafe sistem tata layan table service banding izakaya torikizoku representasi restoran jepang hasil sistem tata layan restoran indonesia jepang milik beda tata layan langgan implementasi praktik langsung restoran prose sambut langgan pesan saji hidang bersih alat meja tawar menu tutup bayar upaya kesan restoran langgan
61,bahasa jepang dewasa bahasa internasional ajar kalang masyarakat bahasa budaya heran disanasini muncul didik sekolah basis jepang latar pikir tulis laku praktek kerja salah lembaga kursus bahasa budaya jepang jlcc japanese language culture centre praktek kerja lapor tugas syarat lulus mahasiswa program diploma samping praktek kerja salah latih manfaat masuk dunia kerja dunia masyarakat sungguh kenyam bangku kuliah aplikasi langsung dunia kerja tulis laku praktek kerja jlcc tanggal februari maret laksana tulis administrasidan terkadang siswa dengar chokosei praktek kerja tulis halhal alam manfaat hadap dunia kerja
62,onomatope salah konsep bahasa cakap seharihari mediamedia baca utama komik onomatope komik milik paham konteks situasi adegan komik bentuk konsep berbedabeda bahasa onomatope jepang giongo gitaigo kelompok giseigo gijougo giyougo praktik giongo gitaigo komik baca sulit paham konteks situasi adegan komik erti makna onomatope teliti tuju analisis giongo gitaigo komik jujutsu kaisen metode teliti analisis deskriptif kualitatif kumpul giongo gitaigo giseigo gijougo giyougo komik jujutsu kaisen dasar hasil analisis data bahas teliti laku teliti temu data onomatope berbedabeda data kategori giongo data kategori gitaigo data kategori giseigo data kategori giyougo data kategori gijougo teliti tuju wawas ajar bahasa jepang sulit paham makna onomatope komik bahasa jepang paham makna jenis onomatope harap mudah baca paham kondisi komik
63,idiom rupa umpama temu hidup seharihari idiom kali namanama tubuh manusia bentuk unsur leksikal idiom bahasa jepang kanyouku idiom bahasa jepang bahasa indonesia milik erti idiom bahasa milik beda banding idiom bahasa indonesia bahasa jepang temu beda idiom segi makna lekiskal makna idiomatikal unsur bentuk bahasa idiom tulis data video kanyouku bahasa jepang buku bahasa indonesia media sosial instragram data kumpul metode simak menggunaakan teknik catat analisis makna struktur tulis metode referensial teknik pilah unsur dasar analisis tulis kanyouku namanama tubuh data milik makna data kanyouku beda milik makna idiom bahasa indonesia
64,praktek kerja lapang salah syarat akademik selesai didik diploma program studi bahasa jepang fakultas bahasa universitas widyatama tulis laksana restoran jepang tomo sushi more laksana hitung tanggal agustus hinga oktober tomo sushi more lokasi glamour level paris java jlnsukajadi tuju praktek kerja lapang layan saji konsep indah jepang tuang makan bahasa asing komunikasi layan hadap kunjung tulis metode deskriptif metode lapor langsung lapang kumpul data usaha laksana praktik kerja lapang tulis tugas waitress layan kunjung pesan pesan menu cleaning praktek kerja lapang tulis simpul jepang milik konsep indah makan atur gom goshoku gohou strategi tingkat buah pasar bahasa sopan kaku cermin ramah pegawai tomo sushi more layan kunjung
65,laksana praktik kerja merukapan prasyarat lulus diploma bahasa jepang universitas widyatama bandung tulis laku praktik kerja hotel kedaton lokasi suniaraja bandung praktik kerja lapang tanggal juli hotel kedaton rupa salah hotel muka bandung milik ciri khas budaya sunda interior hotel tamu relatif libur weekend tarik minat tulis hotel kedaton media kerja praktik kait bidang ilmu tulis ajar lapor tugas tulis batas budaya etnik aplikasi hotel kedaton interior performance hotel kedaton salah media promosi lapor tugas tuju budaya etnik aplikasi hotel kedaton pengaruh budaya etnik hadap tamu hasil tulis hotel kedaton interior kamar junior suit ukir kesan kamar raja sunda patungpatung wayang batikbatik seragam karyawan semi tradisional kesan tamu indonesia unsur budaya etnik spontan pengaruh hadap wisatawan asing tamu hotel malaysia wisatawan asing kadang berfotofoto unsurunsur hotel bau etnik hotel kedaton milik department department housekeeping tulis tugas roomboy bellboy laundry department milik seragam masingmasing lihat nuansa daerah sunda sisi corak model laksana kerja praktik tulis awas supervisor masingmasing department karyawan hotel prima servis milik bahasa asing tamu hotel domestik mancanegara
66,lapor susun dasar hasil praktik kerja lapang tulis laku indonesia tulis kerja bimbing tanty tugas catat surat dokumen masuk surat distribusi suratsurat kait lapor tugas tulis tarik angkat judul layan surat paket jepang indonesia dasar tulis perihal faktor pengaruh kirim negara jepang teknis susun lapor tulis metode deskriptif metode gambar susun sistematis aktual faktual sistematik baca tulis data pegawai indonesia kait judul lapor manfaat lapor tugas tulis faktor pengaruh kirim surat paket negara jepang indonesia wawas kena jenisjenis layan kirim sedia
67,bahasa rupa media komunikasi efektif orang bahasa asing bahasa masyarakat negara hidup seharihari bahasa asing bahasa komunikasi integrasi dunia contoh orang asing tinggal indonesia pikir bahasa indonesia bahasa asing dunia bahasa jepang bahasa inggris bahasa indonesia bahasa indonesia bahasabahasa ajar bahasa asing orang ajar bahasa asing alas bahasa asing pandang bahasa asing ajar negeri bahasa asing kerja negeri ajar bahasa asing laku sekolah orangorang ajar kursus ajar kursus pandang cepat ajar bahasa asing tulis angkat tema ajar bahasa asing csbi tulis lapor tugas ajar bahasa asing metode ajar bahasa asing ajar bahasa asing otodidak sekolah bahasa jepang ajar kursus orang pilih ajar bahasa asing kursus ajar kursus praktis sesuai lembaga kursus lembaga didik kursus metode ajar agam lembaga didik kursus metode konvensional terap metode konvensional lembaga didik kursus tulis laksana praktik kerja lapang kursus csbi praktik kerja lapang tulis laksana praktik kerja lapang csbi tanggal juli agustus laksana praktik kerja lapang tulis ajar bahasa jepang tulis ajar metode ajar bahasa jepang ajar bahasa jepang csbi tulis ajar susun rencana ajar csbi tulis laku kelas bahasa jepang ajar bahasa jepang ajar bahasa jepang tulis metode ajar ajar bahasa jepang tulis coba metode contoh cipta cakap senang lihat gambar tulis ajar metode mudah ajar lagu metode cipta suasana senang didik rileks konsentrasi ajar simpul tema lapor tugas ajar bahasa asing csbi simpul ajar bahasa asing laku sekolah bahasa asing kursus jadwal laksana kursus praktis sesuai milik didik kerja khawatir metode ajar ajar bahasa asing biaya didik ajar bahasa asing kursus jangkau suasana kelas senang pengaruh hadap proses ajar
68,teliti tuju analisis makna bentuk dajare hadap katakata bahasa jepang dajare salah bentuk lelucon laku masyarakat jepang memplesetkan katakata milik bunyi penggal salah huruf katakata objek teliti ambil anime judul knight lamune fire episode metode teliti deskriptif kualitatif metode kumpul data simak bebas libat cakap metode analisis data metode padan referensial kait teori bentuk dajare pawel dybala kenji arak rafal ryepka kohichi sayama jenis makna teori chaer saji metode informal data teliti data dajare klasifikasi jenis bentuk dajare dajare homofon dajare mora dajare mora dajare ubah mora dajare metatesis mora makna muncul datadata dajare rupa makna leksikal referensial
69,tuju tulis laku praktek kerja lapang penuh syarat akademik program diploma jurus bahasa jepang fakultas bahasa universitas widyatama tulis wawas hadap dunia kerja nyata laku praktek kerja tulis langsung giat laku nawang puspita prima tours travel nawang tours tulis laku praktek kerja lapang nawang tours lokasi gedung propelat suit jalan martadinata cihapit bandung tulis laku kerja praktek nawang tours hitung tanggal maret april laksana praktek kerja tulis laku observasi tulis kerja nawang tours dasar observasi laku tulis tulis lihat kerja tugas tour pesan tiket lainlain tour tugas paket wisata urus dokumendokumen jalan pasport visa pesan tiket tugas bantu layan informasi hubung tiket pesawat kereta lainlain uang tugas atur uang usaha marketing tugas promosi paketpaket wisata masyarakat nawang tours travel agent palayanan jasa masyarakat laku giat wisata wisatawan mudah praktis wisata giat jadwal travel agent
70,lapor tugas milik tuju bidang tuju kirim tenaga kerja yayasan mulia meisou indonesia angka tenaga kerja pengaruh faktor lansia banding jatuh angka lahir jepang shousika seberang indonesia rupa angkat kerja kerja upaya indonesia jepang laku kerja bilateral nama ijepa ketenagakerjaan salah bidang metode deskriptif kuantitatif lapor deskripsi tekan hubung statistik data prefektur aichi posisi kerja paruh total data kerja dasar jenis kelamin milik beda tipis bidang masingmasing mayoritas
71,hotel sarana akomodasi orang cari tinggal libur fungsi hotel sarana inap fungsi hotel laksana resepsi nikah temu bisnis seminar giat tulis laksana praktik kerja lapang hotel ibis budget bandung lokasi jalan asia afrika paledang lengkong paledang lengkong kota bandung jawa barat hitung tanggal maret april tuju tulis lapor tugas tingkat puas tamu hadap layan housekeeping hotel ibis budget bandung metode tulis tugas metode deskriptif metode lapor langsung lapang kumpul data usaha laksana praktik kerja lapang tulis tugas usaha food beverage housekeeping room attendant praktek kerja lapang tulis ambil simpul tingkat puas tamu hadap layan housekeeping hotel ibis budget bandung puas data respon positif respon negatif imbang solusi hotel hadap respon negatif staf housekeeping hati bersih kamar indah bersih hotel jaga
72,praktik kerja lapang salah syarat akademik selesai didik diploma program studi bahasa jepang fakultas bahasa universitas widyatama tulis laksana praktik kerja lapang angkasa pura cabang bandar udara internasional husein sastranegara bandung laksana hitung tanggal desember januari angkasa pura lokasi pajajaran bandung tuju praktik kerja lapang tulis lapor layan jasa unit information customer service tingkat mutu layan tingkat puas konsumen hadap layan unit information customer service bandar udara husein sastranegara bandung metode tulis lapor metode deskriptif metode ambar kondisi obyek kelompok manusia sistematis faktual langsung lapang sebar kuesioner kumpul data usaha hasil kuesioner tingkat puas konsumen responden puas layan unit information customer service bandara husein sastranegara bandung laksana praktik kerja lapang tulis tugas unit information customer service layan jasa bandar udara announcement kena informasi putar bandara jadwal terbang langsung langsung tulis harap alam laksana praktik kerja lapang manfaat baca
73,bahasa sistem lambang bunyi arbitrer alat komunikasi interaksi masyarakat individu kelompok bahasa jepang salah aspek perhati proses pendek singkat milik arti bahasa jepang shouryaku teliti tuju jenis alam shouryaku anime relife proses bentuk jenis shouryaku anime relife teliti metode deskriptif kualitatif sumber data teliti anime relife metode kumpul data teliti metode simak teknik dasar teknik simak bebas libat cakap metode analisis data metode agih teknik unsur langsung data analisis teliti saji hasil analisis data metode informal teliti bahas proses shouryakupemendekan anime relife hasil teliti data temu data masuk jenis bahasa jepang jenis temu wago data kango data gairaigo data data kelompok proses bentuk shouryaku anime relife proses bentuk shouryaku tanshiki shouryaku data fukushiki shouryaku data bentuk sederhana istilah temu
74,komunikasi tanda hidup manusia manusia makhluk sosial komunikasi jantung tindak sosiologi masyarakat kelompok manusia hasil aneka ragam bahasa sebar dunia ajar bahasa rupa ajar terap hidup seharihari zaman maju teknologi canggih informasi tuju luput ajar bahasa mustahil didik bahasa kaji ubah alih kode unsur campur kode unsur wujud tuju tulis coba teliti ubah alih kode unsur campur kode lagulagu album from lahir persfektif teliti aspek kandung deskripsi wujud alih kode unsur campur kode lirik lagulagu terang faktor alih kode unsur campur kode lagulagu sisi vals values attitudes lifestyle dengar lagu metode kualitatif tulis coba deskripsi maksud lirik lagu nyanyi bahasa pesan dengar lagu
75,praktik kerja susun lapor rupa salah syarat lulus mahasiswa program diploma program studi bahasa jepang fakultas bahasa universitas widyatama tulis laksana praktik kerja lapang dinas pariwisata budaya provinsi jawa barat letak martadinata bandung praktik kerja lapang laksana tanggal juni juli kerja pagi sore tugas tulis angkat tema selenggara jawa barat travel exchange media promosi pariwisata jawa barat tugas tulis batas kena dinas pariwisata budaya provinsi jawa barat manfaat giat media promosi pariwisata jawa barat laksana praktik kerja tulis bidang pasar giat tulis kerja surat tugas surat nota dinas tik bahan promosi lapor giat lapor giat lapor triwulan hasil telaah tulis simpul rupa giat kerjasama dinas pariwisata budaya provinsi jawa barat asita temu sellers hotel restoran kawasan wisata maskapai terbang buyers agenbiro jalan negeri bidang pariwisata materi gelar giat travel exchange post tour performance giat manfaat hadap pariwisata jawa barat tingkat kunjung wisatawan domestik mancanegara devisa
76,tugas bahas peran interpreter latinusa tuju teliti peran orang interpreter latinusa metode teliti teliti metode teliti kualitatif ambil data wawancara hadap responden interpreter latinusa dasar data peran interpreter bantu komunikasi arah halhal perhati orang interpreter maksud tuju bicara istilahistilah khusus kerja mesin alur produksi hambat miss slitting istilahistilah khusus usaha adaptasi bahasa pakai usaha strategi hambat ajar cari informasi sebanyakbanyaknya ajar bahasa pakai usaha
77,praktik kerja lapang salah syarat akademik selesai didik diploma program study bahasa jepang fakultas bahasa universitas widyatama tulis laksana praktik kerja lapang hotel baltika hitung tanggal januari februari hotel baltika bandung lokasi gatot subroto bandung tuju praktik kerja lapang pasar produk hotel fasilitasfasilitas milik hotel strategi komunikasi tingkat kunjung informasi mahasiswa universitas widyatama tarik dunia hotel metode tugas metode deskriptif gambar susun sistematis aktual cermat tulis laku langsung lapang kumpul data usaha sangkut laksana praktik kerja tulis departemen sales marketing hotel laku tawar promosi langsung perusahanperusahaan laku following layan tamu restoran layan tamu ruang meeting layan tamu acara nikah hotel laku tunjang hasil buah pasar hotel tulis harap alam laksana praktik kerja lapang manfaat baca khusus tulis
78,terjemah rupa giat pesan kandung bahasa bahasa sesuai tata bahasa gramatikal bahasa tuju terjemah terjemah ilmu informasi menyebarluaskan karya sastra film novel buku komik teliti tuju deskripsi teknik terjemah komik spyxfamily deskripsi teknik terjemah dominan faktor melatarbelakangi teknik komik spyxfamily teliti teori terjemah newmark teori teknik terjemah muka molina hurtado albir teliti rupa teliti deskriptif kualitatif sumber data teliti komik spyxfamily karya tatsuya endo metode kumpul data metode simak bebas libat cakap teknik slbc metode analisis data metode padan teknik dasar metode padan translasional teknik hubung banding beda teknik saji hasil analisis data formal informal laku teliti analisis data temu hasil teknik modulasi data teknik reduksi data terjemah harfiah data amplifikasi linguistik data padan lazim data kompresi linguistik data adaptasi data teknik dominan teknik modulasi faktor ambiguitas tingkat lazim bahasa tingkat halus bahasa
79,bahasa rupa struktur makna bebas penggunaanya tanda simpul tuju katakata kumpul milik makna susun alfabetis arti buku buah kamus buah katakata temu kamus katakata rupa main main rupa teknik susastra modifikasi muncul makna teliti tuju papar jenis main fungsi bentuk namanama kuat muncul buah karya anime teliti metode deskriptif kualitatif teliti katakata data teori main humanika teori main mark nichol data teliti anime judul edens zero episode bentuk namanama kuat unik temu kamus analisis data laku klasifikasi jenis main namanama kuat sesuai teori main akronim homonim anagram goroawase teliti temu data data akronim data homonim data anagram data goroawase
80,this research discusses analysis meaning japanese proverbs using flower word hana equivalence indonesian language proverbs groups words sentences that have permanent structure that resembles certain intention also could defined expression dense summary containing comparison analogy advice principles life code behavior this research describe meaning japanese proverbs that employs word hana equivalence meaning meaning japanese proverbs that word hana with indonesian proverbs data this research were obtained from dictionary japanese websites that were related proverbs data were collected using listening method notetaking technique addition that data analysis used referential method with element selection technique regard meaning itself this study referred dedi sutedi theory dasar dasar linguistik based data analysis could concluded that collected data there were eight japanese proverbs that used flower word hana equivalence meaning japanese proverbs indonesian proverbs
81,penuh syarat lulus akademik program studi bahasa jepang diploma fakultas bahasa universitas widyatama salah mahasiswa laksana praktik kerja lapang susun lapor praktek kerja tulis laksana praktek kerja lapang laksana tanggal maret tanggal april excellent holidays tour travel jlwr supratman bandung jawa barat indonesia lapor tugas tulis ambil judul excellent holidays tour travel travel agent industri wisata salah tuju praktik kerja lapang peran usaha travel dunia pariwisata wisata kembang salah hasil devisa negara laksana praktek kerja tulis domestik divisi tugas layan konsumen pesan tiket invoice bukti bayar telefon masuk kirim paket tour promosi email traveltravel jalin kerjasama usaha excellent holidays tour travel excellent holidays tour travel biro jalan usaha agent biro jalan bantu promosi paketpaket tour usaha travel usaha jalin kerjasama airlines mudah pesan tiket domestik internasional tukar informasi kena voucher hotel promosi wisata tulis batas kena excellent holidays tour travel travel agent industri wisata bentuk kerjasama jalin lembagalembaga taung usaha excellent holidays tour travel jalan peran travel agent urai tulis tarik selukbeluk industri pariwisata jalin kerjasama selenggara wisata pasar laksana praktek kerja lapang excellent holidays tour travel bandung laksana praktik kerja lapang tulis lihat langsung giat pasar pariwisata kena dunia kerja sungguh
82,aizuchi rupa ekspresi temu cakap orang jepang respon hadap bicara cakap kaku tuju teliti bentuk fungsi aizuchi vlog akaneteki nihongo kyoushitsu judul nihongokaiwa dagashiba taberu tok teliti deskriptif kualitatif metode kumpul data metode simak teknik simak bebas libat cakap tulis simak catat aizuchi video libat langsung cakap metode analisis data tulis metode padan pragmatis libat mitra alat analisis hasil teliti data bentuk aizuchi unazuki data odoroki data kido airaku data kanshin shimesu data ryoukai data doui data fungsi aizuchinya kalsifikasi fungsi kiiteiru shingou data rikai shiteiruto shingou data doui shingou sebanayak data kanjyou nohyougen data
83,tema angkat lapor tugas asimilasi budaya jepang indonesia operasional prasadha pamunah limbah industri ppli tuju tulis lapor tugas nilainilai budaya jepang terap kerja ppli pengaruh kerja jepang akibat asimilasi giat kantor ppli tulis laksana praktik kerja lapang prasadha pamunah limbah industri ppli alamat raya nambo desa nambo camat klapanunggal bogor tanggal februari praktik kerja lapang tulis administrasi tugas laku analisa hadap kerja sales susun lapor tulis metode susun deskriptif metode teliti fenomena gambar sistematis dasar giat praktik kerja lapang tulis tarik simpul budaya jepang terap ppli aisatsu salam jepang iri seiton seisou seiketsu shitsuke yubisashi kanko kerja jepang pengaruh akibat asimilasi giat kerja kantor adaptasi kerja lambat kerja kerja atur
84,lapor tugas susun dasar hasil praktik kerja lapang deer park golf club nara jepang laksana praktik kerja lapang tulis caddy lapor tugas tulis angkat tema tugas caddy teknik kuasa lapang deer park golf club nara jepang teknik tulis lapor tugas tulis metode field research metode deskriptif metode field research metode ajar kumpul data langsung wawancara catat aju pertanyaanpertanyaan metode deskriptif prosedur pecah diselediki gambar subjek objek teliti rupa orang lembaga masyarakat dasar faktafakta tugas laku tulis seharihari bantu teman main golf main golf tuju tugas deskripsi tugas laku orang caddy deer park golf club hadap main golf kait teknik main poin deskripsi salah laku caddy lapang pengaruh poin main golf deskripsi solusi laku orang caddy salah simpul tulis tugas caddy paham tugas kerja paham atur golf fokus hadap bola main golf main langsung salah salah hitung jarak bukit hilang fokus lihat bola bola hilang cari solusi salah cari solusi pakai lapang patok jarak manhole temu pohon bunker laku training caddy senior house caddy manfaat lapor tugas baca paham tugas caddy berlarilari cari bola stick golf clubs perhati caddy
85,iklan media elektronik televisi seringkali buah usaha iklan produk anggap cepat tarik konsumen visual audio jalan cerita unik tingkat brand awareness produk iklan tagline mudah konsumen produk kalimat tuju teliti analisis tanda tanda makna tagline buah iklan iklan fokus teliti tulis piece nissin noodles hungry days edisi zoro scene pilih scene pilih analisis metode padan referensial analisis peristiwaperistiwa buah tanda tanda kaji semiotika roland barthes scene pilih temu tanda tanda makna tagline aoharu kayo rupa buah janji penuh janji tonjol citra remaja suportif kompetitif fokus berani percaya self efficacy bersungguhsungguh tekad kerja keras sabar konsisten ambisi pantang serah motivasi dukung
