,abstract
86,salah syarat lulus akademik program studi diploma bahasa jepang fakultas bahasa universitas widyatama bandung mahasiswa laksana praktik kerja lapang susun lapor praktek kerja lapang minimal praktek kerja tulis laksana hitung januari februari oisca training center lokasi cimenteng desa sukamulya cikembar kabupaten sukabumi jawa barat oisca training center rupa organisasi internasional nirlaba pusat jepang tanggal oktober yonosuke nakano oisca training center kerjasama perintah indonesia tanggal januari departemen sosial indonesia oisca training center tuju tingkat semangat budaya karya masyarakat khusus masyarakat negaranegara kembang program kembang terampil tani ternak tata boga permebeulan laksana praktik kerja lapang tulis observer tugas uji perilaku siswa oisca sample adaptasi hadap culture shock latih oisca laku praktik kerja lapang tulis paham bentuk strategi siswa adaptasi hadap culture shock oisca training center tulis angkat tema lapor tugas kena strategi adaptasi siswa latih utama hadap culture shock lingkung oisca training center
87,fauzi rupa salah usaha tekstil produksi kain yarn dyed kain yarn dyed fauzi alat tenun mesin jenis shuttle china shuttleless rapier ishikawa jepang lapor bahas proses kain yarn dyed laku fauzi banding proses tenun mesin shuttle shuttleless rapier ishikawa masaingmasing mesin lapor bahas proses kain solusi
88,praktek kerja lapang salah syarat akademik selesai didik diploma program studi bahasa jepang fakultas bahasa universitas widyatama tulis laksana bungou seraph community laksana hitung tanggal maret maret bungou seraph community lokasi jalan pluit karang cantik blok barat muara karang jakarta utara tuju praktek kerja lapang paham kosakata jlpt terjemah kalimatkalimat bahasa indonesia novel dazai osamu nyuusha shiken asagiri kafka tulis metode deskriptif metode lapor langsung lapang kumpul data usaha laksana praktek kerja lapang tulis tugas terjemah dokumen artikel novel ringan video drama praktek kerja lapang tulis simpul terjemah kalimat novel dazai osamu nyuusha shiken ajar bahasa jepang erti kosakata terjemah bahasa indonesia budaya sejarah jepang terjemah
89,praktik kerja lapang susun lapor rupa salah syarat lulus mahasiswa diploma program studi bahasa jepang fakultas bahasa universitas widyatama tulis laksana praktik kerja lapang dinas tenaga kerja transmigrasi provinsi jawa barat letak soekarnohatta bandung praktik kerja lapang laksana hitung tanggal september oktober kerja pagi sore tugas tulis angkat judul proses bekal seleksi calon magang jepang dinas tenaga kerja transmigrasi provinsi jawa barat tugas tulis batas peran dinas tenaga kerja transmigrasi upaya mensukseskan program latih bekal magang jepang melaksanakanparktik kerja tulis bidang latih produktivitas giat tulis kerja surat tugas surat jalan dinas daftar nominatif mobile training unit tembakau rekapitulasi data hasil telaah tulis simpul program latih bekal magang jepang rupa program strategis tingkat anggur efek kontribusi signifikan tekan dampak krisis ekonomi global tingkat devisit negara tingkat masyarakat
90,praktek kerja lapang salah syarat akademik selesai didik diploma program studi bahasa jepang fakultas bahasa universitas widyatama tulis laksana praktek kerja lapang distributor buku dagang hitung tanggal desember januari lokasi komp griya permata asri blok bandung tuju praktek kerja lapang tulis lapor strategi pasar terap pasar bukubuku sekolah buku kelola lapor tulis laku langsung lapang kumpul data usaha laksana praktik kerja tulis staff administrasi jual kerja administrasi usaha kwitansi faktur jual tulis surat tawar surat kerjasama praktek kerja lapang tulis simpul strategi pasar laku liput mengumpulkanmenyusun database calon langgan direct mail presentasi customer gathering strategi tingkat pasar tulis harap alam laksana praktek kerja lapang manfaat baca khusus tulis
91,laksana praktik kerja lapang susun lapor praktik kerja lapang rupa salah syarat akademik selesai kuliah diploma jurus bahasa jepang fakultas bahasa universitas widyatama tulis laksana praktik kerja japanese language management center jlmc alamat jalan supratman bandung hitung tanggal februari maret tulis angkat judul ajar bahasa jepang level dasar jlmc dasar hasil informasi laksana giat praktik kerja lapang sistematika susun lapor praktik kerja lapang laku tulis tinjau langsung tinjau pustaka tinjau langsung liput wawancara tinjau pustaka liput materi ajar laksana praktik kerja lap tulis tugas laku giat administrasi menginput data uang data absensi siswa data formulir siswa laku giat administrasi tulis laku giat terima tamu informasi calon siswa terima telepon
92,kopi rupa salah tanam temu indonesia kopi jenis kelompok kopi robusta arabica salah metode seduh jenis kopi populer indonesia jepang metode manual brewing manual brewing rupa metode seduh kopi manual kopi bentuk biji cangkir kopi minum alat pakai seduh kopi metode hario chemex tulis susun lapor metode komparatif deskriptif komparatif banding variabel sampel beda beda deskripsi hasil banding laku deskriptif metode gambar analisis hasil teliti simpul luas tulis laku praktik kerja moksa coffee shop lokasi jlgagak bandung hitung tanggal tuju lapor tugas banding cita hasil alat kopi nama hario japan chemex america alat hasil banding alat tulis ambil simpul hario hasil enak banding chemex hasil dasar angket langgan moksa coffee shop barista
93,tulis laksana sman pasawahan laksana hitung tanggal maret april sman pasawahan lokasi kapten halim sukamaju pasawahan kabupaten purwakarta jawa barat tuju praktik kerja lapang faktorfaktor sulit ajar bahasa jepang kelas sman pasawahan internal faktor siswa eksternal faktor siswa tulis metode deskriptif metode lapor langsung lapang kumpul data sekolah sangkut angket data tulis data hasil ulang semester ajar kelas angket responden simpul lapor tugas faktor internal faktor eksternal samasama sulit ajar bahasa jepang kelas sman pasawahan faktor internal minat siswa hadap mata ajar bahasa jepang siswa buku mata ajar bahasa jepang buku lembar kerja siswa sekolah faktor bakat siswa alam sulit mata ajar bahasa jepang bahasa jepang rupa mata ajar mudah faktor eksternal sulit ajar bahasa jepang peduli orang hadap giat ajar siswa orang anak ajar bahasa jepang
94,lapor tugas tulis bahas kategori jenis artikel berita japanese station lapor susun dasar hasil praktik kerja lapang tulis japanese station tuju praktik kerja lapang kategori berita shares baca website japanese station jenis artikel japanese station artikel teknik susun lapor tulis metode deskriptif metode gambar susun sistematis aktual faktual sistematik tulis laku langsung lapang kumpul data usaha diskusi staf usaha kait lapor simpul tulis tugas kategori berita dishares baca website japanese station kategori berita movie jenis artikel japanese station eksposisi
95,teliti judul representasi hanakotoba tujuh judul anime bahas kena hanakotoba representasi anime ilmu semiotika roland barthes dasar tarik teliti hadap hanakotoba hanakotoba rupa bahasa bunga bahasa jepang arti masingmasing bunga milik makna ekspresi emosi hanakotoba simbol kode pesan rahasia teliti jenis kualitatif deskriptif laku tuju cari kena jenisjenis bunga anime makna denotatif makna konotatif landas kaji semiotika roland barthes representasi bunga anime capai tuju teliti metode simak teknik sadap teknik simak libat bebas cakap subjek teliti anime unduh situs anime hasil bunga anime milik hanakotoba berbedabeda gantung konteks adegan anime muncul bunga hanakotoba representasi buah anime buah bunga cerita gambar genre cerita tema tokoh
96,skripsi tulis teliti bentuk dialek kansai komik tenshi reta mono terjemah bahasa jepang standar tuju teliti bentukbentuk jodoushi bentuk shuujoshi keiyoushi faktor sosial pengaruh dialek kansai muncul komik selesai teliti tulis data komik tenshi reta mono komik analisis teknik baca simak catat analisis bentukbentuk dialek kansai padan bahasa jepang standar tulis metode intralingual kaji kaji sosiolinguistik metode teliti deskriptif analisis dasar analisis data simpul bentukbentuk dialek kansai komik jodoushi yaro jodoushi shuujoshi keiyoushi muncul faktor sosial pengaruh dialek kansai komik faktor anggota kelompok faktor gender faktor situasifa
97,bahasa jepang bahasa ajar bahasa china indonesia siswa ajar bahasa jepang capai orang siswa ajar bahasa jepang tarik bahasa budaya iring kembang zaman siswa ajar bahasa jepang alas spesifik pergi negara jepang kerja didik negeri sakura anime salah media siswa latih emban kemampuanya bahasa jepang tampil tarik anime milik gaya bahasa ringan mudah erti mahasiswa media ajar ajar bahasa bermacammacam audio visual video musik gambar alat raga mudah siswa kembang bahasa jepangnya lapor tugas tulis bahas dampak anime hadap bahasa jepang mahasiswa prodi bahasa jepang universitas widyatama teknik tulis susun tugas metode kuesioner tulis susun buah kuesioner tulis sebar mahasiswa program studi bahasa jepang universitas widyatama teliti tulis simpul rupa dampak positif dampak negatif mahasiswa program studi bahasa jepang universitas widyatama
98,tulis laku praktik kerja lapang puri pustaka lokasi jlterusan logam bandung hitung februari februari puri pustaka salah usaha gerak bidang cetak buku praktik kerja lapang tulis produksi bidang editing peran fungsi editor usaha cetak kerja editor sunting naskah milik kualitas terbit usaha cetak tugas tulis angkat judul peran editor terbit buku puri pustaka susun lapor tugas metode metode observasi deskriptif praktik kerja lapang tulis tinjau langsung lapang kumpul data dukung susu lapor tugas saji papar perinci gambar aktivitas ptpuri pustaka sistematika kerja editor praktik kerja lapang tulis simpul kompetensi editor tulis senang baca asai eja tata bahasa milik sifat tekun kuasa bidang paham gaya tulis peran editor usaha terbit puri pustaka tingkat kualitas usaha penyetuju layak terbit saran desain cover peratara usaha tulis naskah
99,praktik kerja lapang salah syarat akademik selesai didik diploma program studi bahasa jepang fakultas bahasa universitas widyatama tulis laksana praktik kerja lapang bimandiri agro daya hitung tanggal agustus agustus bimandiri agro daya lokasi panorama haurpungkul lembang bandung tuju praktik kerja lapang proses tangan pasca panen kedelai edamame proses terima receiving kemas labeling epak transportasi bimandiri agro daya metode tugas metode deskriptif gambar susun sistematis aktual cermat tulis laku langsung lapang kumpul data usaha sangkut laksana praktik kerja tulis receiving sortasi kemas labeling usaha tulis laku giat terima hadap komoditas usaha klasifikasi komoditi kelompok tulis laku kemas labeling hadap komoditi kirim toko proses laku bimandiri agro daya jaga kualitas edamame edamame simpan sejuk plastik kemas lubang panas kemas perangkap susut berat cegah proses sortasi detail laku kelompok hasil edamame kualitas proses kemas edamame laku jamin lindung kirim aman hadap edamame jaga kualitas edamame tangan konsumen lapor harap informasi mahasiswa universitas widyatama tarik dunia tani
100,tugas praktik kerja laku prasyarat lulus universitas widyatama fakultas bahasa program studi tulis laku kerja praktik museum geologi lokasi diponegoro bandung kerja praktik laku hitung tanggal februari tanggal juni pokok bahas tugas fokus pengaruh bahasa asing front office museum geologi hadap kunjung bahasa asing bahasa jepang front office museum geologi praktik kerja lapang tulis front office giat tulis laku laksana praktik kerja menginput kunjung buku lapor paham pandu sebar angket kunjung pandu wisatawan jepang kunjung kunjung tulis museum melihatlihat bendabenda koleksi museum tampil cari pandan bahasa jepang wawas bahasa rupa modal utama orang front office bahasa orang kunjung realisasi kunjung orang tugas front office kuasa bahasa asing orang front office berpenampilan tarik pikir cepat ramah kunjung museum geologi duduk jepang kenal suka wisata jarang bahasa asing bahasa orang jepang bahasa asing bahasa inggris paksa ajar bahasa asing duduk asli indonesia front office museum geologi ajar bahasa bahasa sapa selamat selamat pagi bantu hasil kuesioner tulis kunjung kena bahasa asing gambar orang kunjung bahasa asing front office museum geologi
101,lapor susun dasar hasil praktik kerja lapang laksana ylpkpkb cianjur rupa salah syarat akademik selesai didik diploma program studi bahasa jepang fakultas bahasa universitas widyatama laksana praktik kerja lapang ylpkpkb tulis tugas ajar tuju tugas proses didik latih banding program magang program ahli khusus ylpkpkb wawas tulis baca hadap lembaga latih kerja metode tulis susun tugas metode observasi komparatif deskriptif gambar banding hasil langsung kunci proses didik latih program magang program ahli khusus banding program
102,masuk globalisasi usaha indonesia kerjasama negara asing salah negara jepang kuasa hadap bahasa jepang lancar komunikasi butuh csbi kursus bahasa jepang ajar proses ajar ajar bahasa jepang pengaruh hadap hasil kemam orang lihat latar tulis angkat tema sistematika proses ajar bahasa jepang lembaga citra sarana bahasa informatika csbi bandung proses ajar ajar bahasa jepang peran lembaga dukung proses ajar ajar tulis laksana praktik kerja lembaga csbi rupa lembaga didik nonformal lokasi jalan pahlawan bandung laksana praktik kerja tulis front office asisten ajar bahasa jepang tulis lihat langsung giat ajar ajar bahasa jepang tulis mengatahui sistematika proses ajar bahasa jepang lembaga csbi khusus kelas shokyu sistemtika donyuintoduction kaisetsupenjelasan renshulatihan hyokaevaluasi tulis nyata proses ajar ajar efektif efisien sistem dukung fasilitas giat ajar ajar jalan lancar
103,praktik kerja lapang salah syarat akademik selesai didik diploma program studi bahasa jepang fakultas bahasa universitas widyatama tulis laksana praktik kerja lapang zeroone drive hitung tanggal juni zeroone drive lokasi hiranocho ragaa building hiranocho chuoku osaka jepang tuju praktik kerja lapang tulis lapor giat tulis japan business internship program jbip jepang nilainilai ajar internship zeroone drive kenal indonesia masyarakat jepang metode tulis lapor metode deskriptif gambar susun sistematis aktual cermat tulis laku langsung lapang kumpul data usaha sangkut wawancara usaha cerita alam alami langsung tulis laksana praktik kerja tulis tugas presentasi lapor kunjung universitas sekolah kunjung production studio rekam print factory teman shachou meeting tobikomi tulis harap alam laksana praktik kerja lapang manfaat baca khusus tulis
104,sadar jalan masuk arti maksimal hadap saing dunia internasional kembang dunia internasional bahasa jepang nampaknya eksistensi tulis coba telusur laksana praktik kerja japanese language culture centre jlcc tulis lapor praktik kerja rupa salah syarat lulus mahasiswa program diploma jurus bahasa jepang fakultas bahasa universitas widyatama laksana praktik kerja mahasiswa harap selesai kredit semester tulis laksana praktik kerja jlcc lokasi jalan sabang bandung jawa barat tanggal maret tanggal maret jlcc kursus bahasa jepang praktik kerja tulis administrasi orang ajar bahasa jepang batas siswa sekolah guru orang milik profesi dokter jurnalis wartawan guru seniman pendeta pegawai usaha ajar bahasa jepang lihat siswa ajar jlcc umur jlcc bina masyarakat kuasa paham aspekaspek bahasa budaya jepang hasil tenagatenaga ahli kompetensi penuh butuh ajar masyarakat jalur didik sekolah didik formal jlcc bantu cerdas hidup bangsa tingkat kwalitas didik wujud masyarakat maju adil makmur laksana praktik kerja tulis alam ajar manfaat bangku kuliah wawas tulis urai tulis simpul praktik kerja rupa salah mata kuliah manfaat kesiap mental mahasiswa rangka kembang potensi kena dunia kerja sungguh
105,ubah sistem didik tingkat dasar tingkat guru online pandemic covid sistem giat ajar ajar alih giat ajar ajar elearning daring elearning daring buah proses ajar basis elektronik salah media jaring komputer kembang bentuk basis kembang jaring komputer luas internet sistem elearning lapor tugas tulis angkat tema efektifitas sistem kuliah online prodi bahasa jepang universitas widyatama teknik susun lapor tulis metode deskriptif gambar susun sistematis aktual faktual sistematik tulis laku survey sebar angket mahasiswa prodi bahasa jepang universitas widyatama responden kait tema lapor universitas widyatama milik sistem selenggara kuliah online widyatama website khusus mahasiswa mudah akses materi tugas quis lainlain nyata sistem kuliah online efektif kendala alami mahasiswa jaring jelek kuota batas universitas meminimalisir kendala alami mahasiswa cipta ajar lancar nyaman
106,usaha sedia jasa perusahaanperusaahan usaha sedia jasa kumpul informasi lowong kerja cari infprmasi kunjung alamat situs internet kenal online akal cahaya media khusus karirup salah usaha gerak bidang media online jasa rupa bentuk informasi cari kerja kait tulis proses masuk data lowong kerja media online layan media online hubung jaring internet internet rupa jaring milik informasi digital transfer data media elektronik tulis laksana praktik kerja lapang akal cahaya media lokasi jalan pangkur bandung tulis laksana kerja praktik kurun hitung tanggal maret laksana ptacm liput proses menginput data lowong kerja sortir data sumber pasu data sortir server usaha mengupload data informasi lowong kerja cari kerja karirup tawar mudah kunjung situs lowong kerja member member untung member akses cepat info puluh lowong kerja hubung cari kerja lihat cari kerja tampil karirup website sedia karirup tarik simpul sarana media online cari lamar kerja sulit bantu situs lowong kerja sedia karirup
107,zaman orang ajar bahasa jepang salah film animasi ragam bahasa ragam bahasa golong dasar bahasa jenis pakai bahasa ragam bahasa dasar dialek logat daerah didik umur duduk akrab ragam bahasa bahasa jepang dasar kenal keigo bahasa hormat jenis sonkeigo kenjyougo teineigo teichougo bikago teliti lepas ruang lingkup sosiolinguistik ragam bahasa hormat keigo lingkung masyarakat teliti metode tulis teliti metode deskriptif kualitatif deskripsi segi konteks cakap ragam bahasa kuat teori ragam bahasa keigo tsujimura data teliti anime overlord season anime ragam bahasa keigo analisis teliti mengklafisikasikan kalimat kandung ragam bahasa keigo dasar teori bentuk keigo temu data ragam bahasa keigo dasar jenis data sonkeigo data kenjyougo data teineigo data kenjyougoteineigo
108,praktik kerja lapang susun lapor rupa salah syarat lulus program diploma program studi bahasa jepang fakultas bahasa universitas widyatama tulis laksana praktik kerja lapang levelup konveksi bandung pondok bandung email levelupkonveksigmailcom website wwwlevelupkonveksicom praktik kerja lapang laksana hitung tanggal agustus september tugas tulis angkat judul aplikasi bahasa emarketing levelup konveksi bandung tugas tulis batas aplikasi kalimat persuasif tarik minat konsumen emarketing pengaruh usaha membadningkan bentuk emarketing indonesia jepang melaksanakanparktik kerja tulis marketing usaha giat tulis kerja baharu iklan thread kaskus website facebook interaksi konsumen langsung temu langsung online chat blackberry messenger tulis simpul pasar internet emarketing salah revolusi bidang pasar bahasa buah iklan website thread internet cermin kredibilitas buah usaha mata konsumen laksana praktik kerja lapang tulis alam proses produksi pakai sikap marketer moga lapor manfaat tulis khusus baca informasi mahasiswa universitas widyatama tarik kerja bidang marketing
109,hotel inap hotel bersenangsenang keluarga libur minggu wisata resort temu pesta nikah pentas seni hotel akibat saing hotel kedaton bandung laku tingkat kunjung tulis laku praktik kerja lapang hotel kedaton departement housekeeping prosedur kerja making sweeping mopping vaccuming tulis laku praktik kerja lapang tulis lihat usaha hotel kedaton bandung usaha tingkat kunjung segi pasar brosur pasang iklan yellow pages programprogram konser musik pentas seni budaya acara pamer bentuk promosi masuk layan hotel milik staff bicara bahasa asing bahasa inggris bahasa asing guide service tunjang segi fasilitas karaoke kolam renang ruang seminar segi fasilitas pamasaran usaha laku hotel kedaton bandung tingkat kunjung capai lihat data kunjung desember kunjung tingkat capai orang
110,laksana praktik kerja laku syarat lulus mahasiswa program diploma jurus bahasa jepang fakultas bahasa universitas widyatama bandung praktik kerja laksana tulis tuju terap ilmu kuliah langsung terap dunia kerja nyata wawas alam tulis praktik kerja laksana tulis langsung tanggal maret tanggal april dinas pariwisata kota bandung lokasi jalan achmad yani bandung laku praktik kerja tulis buah gambar dunia kerja tulis jalan tulis laku giat kumpul data olah data informasi kena peran dinas pariwisata tingkat objek pariwisata bandung nyata kota bandung milik potensi wisata indah alam sayang perintah daerah maksimal kelola objek pariwisata rupa aset negara tugas tulis papar kena perananperanan laku dinas pariwisata upaya tingkat mutu peleyanan objekobjek pariwisata sejahtera masyarakat sektor ekonomi daerah kota bandung
111,tingkat minat kerja studi jepang butuh bahasa jepang minimal jlpt tulis tarik teliti ajar intensif efektif capai jlpt studi jepang usaha jasa konsultasi urus dokumen kerja sekolah jepang fasilitas kelas intensif bantu lulus jlpt teliti bahas kena efektivitas metode ajar terap kelas intensif akselerasi hadap orang didik subjek teliti tulis data rupa nilai hasil wawancara responden olah metode deskriptif kuantitatif hasil simpul efektif metode ajar kelas intensif akselerasi tingkat efektivitas kelas intensif akselerasi tulis harap teliti hasil temu manfaat wawas baca kena metode ajar bahasa jepang efektif
112,laku bijak masyarakat ekonomi asean indonesia ketenagakerjaan indonesia milik tantang berwirausaha rupa salah pilih selesai didik guru bisnis main action figure model jepang salah pilih bisnis untung tulis laksana praktek kerja zero toys bandung laksana hitung tanggal februari maret zero toys lokasi sunda lurah kebon pisang camat sumur bandung kota bandung jawa barat tuju praktek kerja lapang pulai bisnis main action figure model jepang hasil untung modal tulis tugas metode metode deskriptif metode lapor langsung lapang kumpul data usaha laksana praktik kerja lapang tulis tugas usaha marketing tugas data hasil masuk jual main praktek kerja lapang tulis simpul pulai bisnis main action figure model jepang modal pangsa pasar jual jenis main agam anak dewasa milik tarik model warna jenis agam harga jual jenis main salah timbang konsumen beli main
113,muhammad zidan setiawan waluya analisis makna motivasi lirik lagu river ship karya skripsi program studi bahasa jepang fakultas ilmu budaya universitas widyatama utama teliti tanda tanda denotasi konotasi lirik lagu river ship tuju teliti makna motivasi kandung mitos lirik lagu river ship teliti metode jenis teliti metode kualitatif objek teliti tanda tanda denotasi konotasi mitos lirik lagu river ship data teliti rupa data ambil lagu karya judul river ship teliti teori semiotika roland barthes metode kumpul data teliti metode simak teknik simak bebas libat cakap teknik catat metode analisis data teliti padan referensial teknik pilah unsur daya pilah referensial hasil analisis data lirik lagu river tujuh tanda tujuh tanda tujuh denotasi tujuh konotasi tujuh mitos lagu ship enam tanda enam tanda enam denotasi enam konotasi enam mitos
114,lapor tugas susun dasar hasil praktik kerja lapang ylpkpkb brother training center cianjur laksana praktik kerja lapang tulis ajar lapor tugas tulis angkat tema strategi ajar bahasa jepang ylpkpkb brother training center cianjur kendala bahasa jepang hidup internship jepang teknik tulis lapor tugas tulis metode deskriptif wawancara prosedur pecah diselediki gambar subjek objek teliti laku cakap arah capai tuju tuju tugas strategi ajar bahasa jepang ylpkpkb brother training center magang kuasa bahasa jepang kendala bahasa jepang hidup internship jepang praktek kerja lapang tulis simpul strategi ajar bahasa jepang ylpkpkb brother training center terap giat ajar interaktif sedia bekal jepang kendala hafal kanji baca kosakata bahasa jepang komunikasi orang jepang langsung magang jepang
115,jepang salah negara akhirakhir sorot ajar dunia didik negeri masuk ajar indonesia didik jepang mudah lihat munculah buah produk jasaagen bantu siswasiswa informasi sekolah jepang urus sekolah jepang indonesia salah produk jasa studi jepang tawar program ajar siswa didik jepang program ajar jangka program jangka pendek beda aspek program siswa pilih program cocok tulis laksana studi jepang laksana hitung tanggal januari februari studi jepang lokasi ruko bengawan floor jalan bengawan bandung tuju praktek kerja lapang tingkat tarik siswa studi jepang dasar program ajar jepang dasar jenis kelamin usia didik alas sekolah jepang dasar pilih program ajar tulis metode deskriptif metode lapor langsung lapang kumpul data usaha laksana praktik kerja lapang tulis tugas promosi sudi jepang lawat sosial media blog pribadi praktek kerja lapang tulis simpul program ajar jangka minat banding jangka pendek minat siswa lakilaki rentang usia didik lulus alas budaya bahasa jepang didik universitas sekolah juru kerja usaha jepang
116,bahasa rupa makhluk sosial alat komunikasi informasi makhluk sosial hibur komik hibur komik film video suara gambar gerak komik onomatope onomatope jenis giongo gitaigo teliti judul analisis struktur makna giongo komik enen shouboutai volume milik rumus struktur giongo komik enen shouboutai makna tuju teliti deskripsi struktur giongo komik enen shouboutai deskripsi maknamakna teliti rupa jenis teliti deskriptif kualitatif metode kumpul simak bebas libat cakap teknik catat teknik analisis teknik padan referensial metode saji data metode formal informal dasar hasil analisis laku pakai teori akimoto teori bentuk giongo hasil bentuk struktur giongo komik enen shouboutai bentuk struktur macammacam karakteristik karakteristik makna berbedabeda
