,abstract
28,laksana praktik kerja laku syarat lulus mahasiswa program diploma jurus bahasa jepang fakultas bahasa universitas widyatama bandung praktik kerja laksana tulis tuju terap ilmu bangku kuliah terap dunia kerja nyata wawas alam tulis praktik kerja laksana tulis langsung tanggal juli tanggal september oriens prima lestari alokasi jalan raya sunan gunung jati cirebon laku praktik kerja tulis alam terap dunia kerja nyata tulis laku giat kumpul olah data giat marketing oriens prima lestari cirebon
29,globalisasi negara buka terima warga negara asing kerja cari ilmu negara salah negara jepang agam program magang beasiswa tawar jepang yumnaa arsy salah lembaga selenggara program latih salur tenaga kerja jepang milik tanggung cipta calon tenaga kerja kualitas daya saing capai manajemen manajemen latih proses rekrutmen latih berangkat negara jepang lembaga latih salur tenaga kerja tulis laksana praktik kerja lapang teliti yumnaa arsy laksana praktik kerja tulis tugas asisten ajar metode teliti teliti kualitatif metode tulis deskriptif tulis papar gambar kena laksana praktik kerja lapang laksana tulis papar manajemen latih lembaga kursus latih yumnaa arsy teknik kumpul data laku laku wawancara observasi narasumber rupa staf pegawai yumnaa arsy hasil teliti simpul manajemen latih yumnaa arsy rancang bantu latih tenaga kerja terampil adaftatif daya saing cakap bahasa bertatakrama sesuai lapang kerja teknik jepang sesuai butuh user usaha jepang
30,program tokutei ginou rupa salah bentuk kerjasama negara indonesia negara jepang tingkat hubung bidang tuju laksana bina hadap kontribusi kembang industri tingkat erti sahabat negara tulis laksana seka mustika indonesia laksana hitung tanggal juni juli seka mustika indonesia lokasi talun rancakendal desa jelegong rancaekek tuju praktik kerja lapang kerja program tokutei ginou selenggara seka mustika indonesia kena daya tarik seka mustika indonesia tulis metode deskriptif metode lapor langsung lapang kumpul data usaha tulis laku wawancara batas pegawai usaha simpul tulis tugas daya tarik program tokutei ginou seka mustika indonesia program tokutei ginou magang laksana program tokutei ginou berangkat jepang melatarbelakangi magang pilih program magang seka mustika indonesia
31,jepang rupa salah destinasi favorit wisatawan mancanegara khusus wisatawan indonesia lapor bahas destinasi utama favorit jepang dasar musim jasa tours travel bandung destinasi utama favorit jepang musim jasa tours travel tokyo lapor informasi destinasi utama favorit dasar kewarganegaraan banding wisatawan indonesia wisatawan asing lapor bahas faktorfaktor wisatawan indonesia tokyo faktorfaktor sedia transportasi canggih lengkap tarik belanja jenis makan jual tokyo tokyo rupa kota aman teknologi canggih lapor tulis metode deskriptif
32,penuh syarat lulus akademik program diploma fakultas bahasa program studi bahasa jepang universitas widyatama salah laksana praktek kerja lapang mahasiswa laksana praktek kerja lapang laksana praktek kerja lapang susun lapor praktek kerja tulis laku praktek kerja tanggal maret april ptvisitour tours travel visitour jalan pati ukur bandung kenal nama visi mandiri januari nama ubah visitour visitour biro jalan bermacammacam layan paket wisata ticketing halhal hubung jalan praktik kerja lapang ajar kali sulit diberitahu karyawan erti dunia travel ajar layan jual tiket pesawat terbang tik bermacammacam surat telepon masuk bantu lomba warna gambar anak warna bahari akhirakhir pariwisata tingkat manamana wisata tarik wisatawan nikmat laku jalan jasa biro jalan biro jalan layan beli tiket paket wisata paket wisata tulis jenisjenis giat laku kunjung harga paket wisata tarik wisatawan tarik beli laku promosi paket wisata iklan surat kabar iklan televisi hadap langgan paket wisata jual pengaruh profit usaha
33,lapor susun dasar hasil praktik kerja lapang tulis selenggara hotel ibis budget asia afrika tanggal maret april praktik kerja lapang tulis housekeeping department room attendant lapor tugas tulis angkat tema tingkat patuh room attendant hadap housekeeping hotel ibis budget sesuai kerja laku praktik kuliah lapang teknik susun lapor tulis metode deskriptif metode gambar susun sistematis aktual cermat sukmadinata tuju informasi aktual factual sistimatik baca tulis laku langsung lapang kumpul data sangkut diskusi pegawai usaha kait tema lapor sebar kuesioner kait tema angkat praktik kerja lapang tulis tugas tanggung pelihara bersih kamar hotel rawat bersih area kamar rawat bersih area kamar hotel standar operasional prosedur taat room attendant standar operasional prosedur laku tahapantahapan rawat bersih kamar hasil observasi laku tulis praktik kerja lapang hadap room attendant hasil room attendant laku kerja sesuai standar operasional prosedur
34,tolak bahasa jepang pikir strategi jaga mitra tolak dengar sopan strategi strategi langsung budaya masyarakat jepang laku tolak teliti tuju analisis buah tindak tolak strategi langsung akibat langgar prinsip sopan kait budaya jepang uchi soto teliti metode deskriptif kualitatif tulis gambar situasi analisis data data drama jepang variasi bahasa drama dengar alami analisis data laku sesuai teori sopan leech strategi tolak beebe takashi ullis teori faktor hayashi teliti temu langgar prinsip sopan tindak tolak strategi langsung data tindak tolak strategi langsung langgar prinsip sopan data tindak tolak strategi langsung langgar prinsip sopan langgar terhadao maksim murah faktor pengaruh langgar faktor ningen kankei naiyou langgar ruang lingkup uchi data tindak tolak langgar prinsip sopan
35,praktik kerja lapang salah syarat akademik selesai didik diploma program studi bahasa jepang fakultas bahasa universitas widyatama tulis laksana praktik kerja lapang media informasi lintas dimensi radio sadang hitung tanggal september september tuju praktik kerja lapang tulis lapor cari maksimal buah program acara radio siar interaktif bahasa siar radio sadang purwakarta solusi informasi mahasiswa universitas widyatama tarik dunia siar metode tulis lapor metode deskriptif gambar susun sistematis aktual cermat tulis laku langsung lapang kumpul data usaha sangkut wawancara batas pegawai usaha tuang alam alami langsung tulis laksana praktik kerja tulis tugas laku proses editing spot iklan mengkonversi format lagu susun playlist siar laku tunjang lancar buah program acara radio tulis harap alam laksana praktik kerja lapang manfaat baca
36,tugas praktik laku syarat akademik lulus program diploma jurus bahasa jepang fakultas bahasa universitas widyatama tulis laku praktik kerja kolam renang sellys swimming pool letak jalan rancagoong turangga bandung tugas praktik kerja selang desember desember kerja tugas praktik tulis posisi ticketing potong tiket pelihara kolam bersih kolam kerja tugastugas posisi kumpul data kolam renang sellys swimming pool rupa salah rintis kolam renang sarana rekreasi keluarga kembang kolam renang sellys swimming pool alam kali ganti manajemen kolam renang sellys swimming pool rekreasi rintis usaha promosi kolam renang sarana didik latih renang usia capai puluh manajemen kolam renang tulis ambil riset laku tugas praktik ajar putar kembang kolam renang kembang bisnis wahana wartatirta wisata main
37,budaya pariwisata rupa pisah budaya budaya budaya asing latar pikir tulis laku praktik kerja lapang salah instansi perintah bidang budaya pariwisata disbudpar laksana praktik kerja lapang susun lapor syarat orang mahasiswa program bahasa jepang universitas widyatama uji komprehensif tuju laksa praktik kerja lapang mahasiswa terap ilmu kuliah nyata bangku kuliah kena dunia kerja harap mahasiswa gambar dunia kerja kerja dunia kerja laksana praktik kerja lapang mahasiswa lapor praktik kerja lapang isi giat laku praktik kerja lapang tulis pilih disbudpar laksana praktik kerja lapang disbudpar tulis laksana praktik kerja lapang tanggal april tanggal april jalan llre martadinata bandung laksana tulis pariwisata tulis laksana praktik kerja lapang disbudpar tulis laku edit surat tik laporanlaporan laksana praktik kerja lapang tulis pariwisata budaya alam harga manfaat hadap dunia kerja nyata kelak tulis harap lapor manfaat baca lapor
38,iring kembang zaman siswa dunia didik negeri contoh negara jepang jepang rupa negara maju bidang minat siswa sekolah jepang agenperusahaan jasa bantu siswa informasi sekolah jepang salah usaha jasa studi jepang siswa didik jepang studi jepang pilih sekolah bahasa jepang jepang kerja studi jepang sekolah kerja sekolah sebar daerah jepang sekolahsekolah milik fasilitas unggul berbedabeda siswa bebas pilih sekolah sesuai kriteria tulis laksana studi jepang laksana hitung tanggal januari februari studi jepang lokasi ruko bengawan lantai jalan bengawan bandung tuju praktik kerja lapang sekolah bahasa jepang jepang minat siswa studi jepang dasar usia jenis kelamin didik daya tarik sekolah pilih favorit siswa studi jepang tulis metode deskriptif metode lapor langsung lapang kumpul data dariperusahaan data tulis data siswa berangkat april juli oktober april data siswa periode siswa simpul tulis tugas siswa studi jepang berangkat april juli oktober april dasar klasifikasi usia didik jenis kelamin pilih sekolah nippon cultureacademy biaya murah banding sekolah ehle institute hotsuma international school angsur gratis biaya sewa apato siswa sedia volunteer sekolah kelas khusus uji bahasa jepang japanese language proficiency test siswa latih laksana
39,bahasa salah alat komunikasi sosialisasi fungsi orang verbal hidup seharihari jarang dengar majas buah karya sastra puisi novel lagu majas teliti tuju papar makna bentuk majas banding lirik lagu bahasa jepang karya radwimps metode berserta teknik tulis skripsi kualitatif metode kumpul data teliti metode simak teknik simak bebas libat cakap metode analisis data metode agih metode alat bahasa sangkut objek sasar teliti data temu lirik lagu nandemonaiya yume tourou sparkle data majas banding temu teliti simile personifikasi metafora lirik lagu nandemonaiya milik majas banding simile personifikasi majas metafora lirik lagu yume tourou kandung majas banding personifikasi metafora lirik lagu sparkle majas banding metafora simile majas banding dominan majas metafora total data
40,music nada nada suara indah kandung irama lagu harmonis suara lagu majas kandung majas media bahasa manfaat proses pesan papar salah jenis majas majas hiperbola majas hiperbola majas rupa teliti tulis temu majas hiperbola bentuk teliti teori sato analisis majas hiperbola teliti ambil sumber data lagu jepang judul lemon karya kenzi yonezu neko karya takumi kitamura metode kumpul data metode simak teknik catat analisis metode referensial teknik pilah unsur dasar hasil analisis kena majas hiperbola lagu lemon karya kenzi yonezu lagu neko karya takumi kitamura simpul data majas hiperbola kumpul lagu lemon karya kenzi yonezu temu majas hiperbola lagu neko karya takumi kitamura majas hiperbola teliti majas hiperbola lagu lemon neko majas hiperbola hubung data
41,teliti teliti tindak ekspresif tindak kelakar variety show arashi teliti tuju deskripsi bentuk tindak ekspresif kelakar klasifikasi tindak ekspresif dasar karakteristik kalimat kelakar variety show arashi jenis teliti teliti kualitatif deskriptif sumber data variety show arashi ambil website livejournal tumblr landas teori yule tindak ekspresif teori leech prinsip kelakar teori taring karakteristik kalimat kelakar metode analisis data metode padan pragmatis data temu teliti analisis data jenis tindak ekspresif temu jenis tindak ekspresif tindak ekspresif ejek marah kritik sindir keluh salah puji terima kasih senang maaf ketidaksukaan khawatir temu data karakteristik kalimat kelakar senda gurau analisis data data karakteristik kalimat kelakar olokolok temu data analisis data karakteristik kalimat kelakar senda gurau tindak data analisis data temu jenis tindak ejek data karakteristik kalimat senda gurau temu data
42,skripsi milik tuju deskripsi diksi gaya bahasa lirik lagu album book karya yoasobi stilistika teliti teliti deskriptif kualitatif teori stilistika teori diksi buku gorys kaf judul diksi gaya bahasa teori gaya bahasa bahasa jepang buku nihongo retoriku karya seto kenichi sumber data teliti lagu album yoasobi judul book teliti temu diksi makna konotatif data makna denotatif data antonim data hiponim data temu gaya bahasa gaya bahasa metafora data gaya bahasa hiperbola data gaya bahasa repetisi data gaya bahasa simile data gaya bahasa personifikasi data gaya bahasa paradoks data gaya bahasa antiklimaks data gaya bahasa antithesis data gaya bahasa meiosis data
43,teknik susun lapor tulis metode deskriptif metode gambar susun sistematis aktual faktual sistematik baca tulis laku langsung lapang kumpul data usaha diskusi pegawai usaha kait tema lapor kerja tulis tugas tanggung produktivitas selamat pegawai heat treatment forge indonesia standar operasional prosedur laku pakai kerja lingkung pabrik manfaat lapor tugas tulis tingkat sadar safety tindak laku tingkat sadar serius kerja safety
44,salah syarat lulus mahasiswa program diploma fakultas bahasa jurus bahasa jepang universitas widyatama wajib penuh praktik kerja lapang lapor tugas laksana praktik kerja lapang mahasiswa tempuh semester tulis laksana praktik kerja lapang hotel seru bogor tulis laksana praktik kerja tanggal januari tanggal januari laksana praktik kerja tulis front office departement bellboy tulis pelatihanpelatihan orang bellboy komunikasi bahasa sopan orang tamu tulis layan orang tamu lokal selesai laksana praktik kerja tulis susun tugas bahas peran bahasa asing bellboy tunjang kualitas layan hotel seru laksana praktik kerja lapang tulis alam tulis manfaat masuk dunia kerja tulis simpul praktik kerja lapang mahasiswa laksana praktik kerja tulis alam mudahmudahan tulis manfaat masuk dunia kerja tulis simpul praktik kerja mahasiswa program diploma tulis
45,susun tugas susun penuh syarat lulus program studi bahasa jepang mahasiswa laksana praktek kerja lapang susun lapor hasil praktek kerja bentuk tugas tulis laksana praktek kerja balai keramik bandung tanggal april balai keramik salah instansi teliti kembang industri keramik indonesia balai keramik jaman jajah belanda giat laku batas teliti kembang keramik pakai alatalat rumah tangga pipa air sawah masuk jajah jepang keramik alam kembang balai keramik nama keramische ganti tok shikenjo giat laku alatalat perang barangbarang tahan cetak logam senjata botolbotol cangkir sake keramik porselen cangkir mangkok piring teko lainlain negeri keramik indonesia agam industriindustri keramik muncul balai keramik tanggung teliti kembang industriindustri keramik laku industri keramik indonesia saing masuk pasar internasional salah giat balai keramik kembang industri keramik tingkat standar mutu keramik giat tangan bidang riset standardisasi laksana praktek kerja tugas rencana teliti kembang jenis keramik bidang kaji revisi standar standar pakai balai keramik standar nasional indonesia mutu keramik syaratsyarat mutu uji nyata penuh standar balai keramik sertifikat keramik penuh standar adakan revisi laksana jalan lancar hambat balai keramik programprogram selesai penuis laksana praktek kerja senang tulis temu alam tulis dunia kerja hadap senang tulis keramik standar mutu harap saran tulis moga balai keramik maju industri keramik indonesia industri keramik indonesia sejajar industri keramik negaranegara mutu
46,praktik kerja lapang salah syarat selesai didik diploma program studi bahasa jepang fakultas bahasa universitas widyatama tuju praktik kerja lapang mahasiswa praktik ilmu ajar bangku kuliah hasil laksana praktik kerja lapang tulis tuang tulis bentuk lapor laksana praktik kerja tulis laksana tanggal februari maret general engineering center ptgec alamat parak bandung jawa barat telpfax tuju lapor bahasa jepang ptgec bahasa jepang serap mesin industri kembang inovasi kualitas layan bidang mechanical electrical engineering installasi maintenance trading ptgec pesan bahanbahan mesin lokal pesan bahanbahan mesin impor ptgec impor mesin negara jepang ptgec laku kerjasama usaha negara jepang terkadang orangorang usaha negara jepang suka laku kunjung hadap ptgec kesan hadap karyawan ptgec wajib ajar bahasa jepang kunjung sapa sambut hadap karyawan bahasa jepang seharihari tulis laku praktik kerja lapang tugas terjemah tamu jepang masuk tamu jepang tulis tugas laku installasi jaring komputer metode caracara laku tulis metode deskriptif metode gambar susun sistematis aktual cermat tulis laku langsung lapang kumpul data usaha sangkut wawancara batas karyawan usaha alam alami langsung tulis tulis harap alam tulis laksana praktik kerja lapang manfaat baca
47,tulis laksana praktik kerja lapang sora japanese language institute laksana hitung tanggal februari april sora lokasi cigadung koa coblong kota bandung jawa barat tuju praktik kerja lapang strategi promosi sora tingkat hasil tindak promosi laku tulis metode deskriptif metode lapor langsung lapang kumpul data giat promosi laku sora data tulis data calon konsumen sora februari april simpul tulis tugas sora terap strategi ground marketing event laku street marketing tindak laku sales call mobile marketing tingkat hasil capai tindak sales call minat mahasiswa area promosi minat lingkung universitas
48,tindak proses interaksi linguistik bentuk libat lawan mitra pokok situasi teliti kena tindak laku teliti teliti kaji tindak kaji pragmatik bentuk tindak direktif video anime episode platform youtube jarang temu teliti bahas kena jenisjenis tindak direktif landas teori namatame episode video anime media sosial youtube teliti pragmatik teori tindak direktif namatame perintah meirei ira larang kinshi izin kyoka anjur teian metode rupa deskriptif kualitatif gambar situasi analisis data dasar hasil analisis data teliti temu jenis tindak direktif namatame anime episode episode menit teliti ambil data episode episode teliti total data kalimat perintahmeirei data kalimat permintaanirai data kalimat larangankinshi data kalimat izinkyoka data kalimat anjuranteian data
49,lapor tugas susun dasar hasil praktik kerja lapang seharihari prodi bahasa jepang universitas widyatama tulis kerja guru dukung mata kuliah kiso nihongo lapor tugas tulis tarik angkat tema analisis sulit mahasiswa tingkat prodi bahasa jepang universitas widyatama mata kuliah kiso nihongo dasar keingintahuan tulis prihal sulit mata kuliah kiso nihongo teknis susun lapor tugas tulis metode kualitatif metode arti perspektif lihat beda garis tulis laku survey sebar kuesioner mahasiswa tingkat universitas widyatama ajar bahasa jepang responden kait tema lapor manfaat lapor tugas tulis sulit mahasiswa tingkat prodi bahasa jepang universitas widyatama mata kuliah kiso nihongo
50,praktik kerja lapang salah syarat selesai didik diploma program studi bahasa jepang fakultas bahasa universitas widyatama tuju praktik kerja lapang mahasiswa praktik ilmu ajar bangku kuliah hasil laksana praktik kerja lapang tulis tuang tulis bentuk lapor tulis laksana praktik kerja lapang burangrang telp email smasbpiyahoocoid bandung tuju lapor media elektronik sarana ajar bahasa jepang bandung salah solusi ajar bahasa jepang proses ajar tulis laku praktik kerja lapang tugas ajar bahasa jepang tugas materi tugas metode caracara laku tulis metode deskriptif metode gambar susun sistematis aktual cermat jaman modern media ajar bahasa jepang mudah tulis manfaat fasilitas tunjang ajar didik bandung bentuk media elektronik ajar bahasa jepang japanese english dictionary kanji recognized imiwa dictionary dictionary latih hadap uji bahasa jepang jaman modern hasil analisis data simpul nilai ratarata kelas dasar hasil data angket responden tuju metode ajar sarana media elektronik responden metode ajar sarana media elektronik responden nyata tuju metode ajar sarana media elektronik tulis harap alam tulis laksana praktik kerja lapang manfaat baca
51,bahasa makhluk sosial alat komunikasi informasi komunikasi orang sumber informasi mitra target informasi tuju komunikasi tindak tindak jenis tindak ilokusi lokusi lokusi teliti judul analisis tindak ilokusi drama jepang hots spicy milik rumus tindak muncul drama makna tuju teliti jenis tindak ilokusi drama maknamakna teliti rupa jenis teliti deskriptif kualitatif metode kumpul data teknik simak bebas libat cakap teknik catat teknik analisis teknik padan pragmatis metode saji data metode informal dasar analisis laku milik hasil jenis tindak ilokus masingmasing ekspresif komusif direktif jenis tindak milik makna puji hina terimakasih tindak ekspresif tindak direktif makna suruh perintah tawar mohon tindak komusif makna acnaman janji kerjasama
52,media online sarana pengaruh sebar informasi indonesia informasi dunia mudah akses media online orang indonesia tarik informasi putar negara jepang media online tulis laksana praktik kerja lapang japanese station lokasi libra lurah batununggal camat gumuruh kota bandung jawa barat hitung tanggal februari maret tuju tulis lapor tugas artikel online minat kalang orang indonesia utama baca situs japanese station halhal melatarbelakangi populer artikel metode tulis tugas metode deskriptif metode lapor langsung lapang kumpul data usaha laksana praktik kerja lapang tulis tugas usaha artikel tugas artikel putar negara jepang utama budaya praktik kerja lapang tulis simpul puluh peringkat artikel online susun kumpul kategori hibur gaya hidup hobi alas melatarbelakangi populer artikelartikel topik bahas tampil
53,bahasa kembang iring jalan kembang hasil salah muncul ragam bahasa slang ragam bahasa sifat nonbaku komunikasi kaum remaja kelompok sosial makna orang kelompok jepang ragam bahasa salah bahasa anak muda wakamono kotoba teliti wakamono kotoba kaji bentuk golong kelas kesalahpahaman makna wakamono kotoba teliti tuju papar bentuk wakamono kotoba deskripsi kelompok kelas teliti rupa teliti jenis deskriptif kualitatif data arsip video talenta vtuber nijisanji unggah situs youtube datadata kumpul teknik simak bebas libat cakap metode teknik analisis laku teliti metode miles hubberman saji metode informal teori teliti teori karakteristik bentuk wakamono kotoba tanaka teori golong kelas murakami kutip sudjianto dahini hasil teliti tulis temu data wakamono kotoba bentuk wakamono kotoba temu dasar teori tanaka jenis singkat silabil unsur singkat tulis temu bentuk wakamono kotoba teori tanaka bentuk wakamono kotoba rubah fonem sufiks tulis golong wakamono kotoba temu kelas kelas meishi benda kelas doushi kerja kelas fukushi adverbia keiyoushi sifat
54,teliti tuju identifikasi tanda verbal nonverbal makna juang tokoh seita film anime hotaru haka kaji semiotika ferdinand saussure teori ferdinand saussure nyata bahasa bentuk sistem tanda tanda rupa sistem buah tanda tanda tanda signifier tanda signified teliti metode deskriptif kualitatif kumpul data metode simak teknik dasar teknik simak bebas libat cakap teknik analisis teori saussure kena tanda bahasa tanda rupa imaji bunyi tanda rupa konsep saji hasil anaslisis data metode formal metode informal sumber data film anime jepang judul hotaru haka hasil teliti data verbal data nonverbal kandung makna juang tokoh seita simpul teliti tanda verbal tokoh seita bahasa mudah paham tanda nonverbal film anime suguh ilustrasi tarik nyata audiens paham makna juang laku tokoh seita
55,penul laksana prakt kerja lapang universi widyatama program studi bahasa jepang laksana terhi tung tanggal sept ember oktober penul tugas admin media sosial instagram program studi bahasa jepang kerja prakt penul tugas isi konten budaya jepang instagram program studi bahasa jepang diii lapor tugas akh penul angkat tema banding konten media sosial universi widyatama universi osaka mamp tingkat akun kerja media sosial prodi bahasa jepang sekal igus tingkat kual market prodi bahasa jepang universi widyatama jalur media sosial laku tel harap universi widyatama akun media sosial mem kenal masyarakat khusus ajar calon mahasiswa bidang didik jenjang inggi universi metode metode ethnography metode kual tua riset sosial metode membadingkan jenis kategori mencar letak sumber cari solusi penul laku kumpul data sumber utama masingmasing media sosial laku pantau khusus hadap kerja media sosial has puas alas tel butuh universi manfaat lapor tugas akh penul kembang budaya jepang unggah konten budaya jepang media sosial penul budaya jepang sepert minat audiens
56,salah syarat lulus akademik program studi diploma bahasa jepang fakultas bahasa universitas widyatama bandung mahasiswa laksana praktik kerja lapang susun lapor praktik kerja lapang minimal praktik kerja tulis laksana hitung februari februari prasadha pamunah limbah industri lokasi raya nambo desa nambo camat cileungsi kabupaten bogor provinsi jawa barat indonesia prasadha pamunah limbah industri industri olah limbah komperhensif indonesia rancang respon tingkat prihatin degradasi lingkung indonesia industrialisasi pesat laksana praktik kerja lapang tulis laboratorium tugas uji analisis sample memonitoring hasil proses limbah penuh baku mutu laku praktik kerja lapang tulis ilmu dasardasar olah limbah bahaya bahaya prasadha pamunah limbah industri tulis angkat tema lapor tugas kena kelola limbah prasadha pamunah limbah industri
