,abstract
402,koperasi lepas dinamika ubah internal eksternal koperasi tuntut laku suai tatanan giat usaha proses produksi layan strategi pasar saing lingkung kapasitas manajemen peran urus tuntut gerak efisien efektif kerah sumber daya milik teliti ambil judul pengaruh program didik latih hadap produktivitas kerja karyawan trisula kabupaten majalengka metode teliti deskriptif tuju teliti maksud uji variabel program diklat produktivitas kerja hasil teliti tanggap responden kena program didik latih karyawan trisula dasar tanggap responden nilai ratarata nyata interval produktivitas kerja karyawan trisula dasar tanggap responden nilai ratarata nyata interval pengaruh program didik latih hadap produktivitas kerja karyawan trisula dasar hitung koefisien determinasi sisa pengaruh faktorfaktor teliti hubung laksana program didik latih produktivitas kerja karyawan arti hubung kuat interval hasil hipotesis simpul program didik latih pengaruh hadap produktivitas kerja karyawan produktivitas kerja karyawan pengaruh hadap program didik latih
403,pustaka rupa salah sedia buku media ajar buku sedia pustaka saji buku sulit mudah bukubuku kategori dasar kategori masingmasing pengkategorian klasifikasi dokumen teks rupa sinopsis buku dasar proses manfaat teknologi text mining algoritma na ve bayes classifier metode pengkategorian dokumen sinopsis buku kelola dokumen sinopsis buku metode text mining milik tahap case folding tokenizing filtering stemming proses pengkategorian dokumen metode na ve bayes terap algoritma na ve bayes data dokumen sinopsis buku model klasifikasi kelompok karakteristik masuk kategori buku sedia tingkat akurasi algoritma na ve bayes klasifikasi dokumen sinopsis buku lihat persentase akurasiya hasil persentase akurasi dokumen sinopsis buku scenario persentase data seseuai skenario data sesuai data sesuai skenario data sesuai data sesuai skenario data sesuai
404,indonesia rupa negara puluh provinsi aneka ragam budaya satwa hidup daerah unik ciri khas negara indonesia indonesia puluh pulau milik daerah air terbagibagi ciri khas rupa satwa laut tinggal utama spesies punah buru manusia rusak tinggal satwa limbah hasil manusia rancang aplikasi ajar basis mobile satwa laut langka indonesia unified modeling language usecase diagram class diagram activity diagram sequence diagram kembang unity lihat gambar video satwa laut langka quiz satwa laut langka aplikasi aplikasi metode black evaluasi aplikasi coba rupa kuesioner hasil mudah aplikasi tombol aplikasi fungsi sepenuh informasi mudah paham simpul aplikasi bangun basis mobile android satwa laut langka indonesia desain interaksi bangun tarik mudah koresponden
405,tugas judul sistem dukung putus kredit mobil astra international isuzu division makassar tuju utama perangkat lunak harap bantu manager ambil putus layak orang langgan terima kredit perangkat lunak rupa salah bentuk sistem dukung putus tugas bangun perangkat lunak evaluasi layak kredit langgan alat bantu ambil putus usaha langkahlangkah rancang sistem liput analisa sistem perinci alat bantu data flow diagram entity relational diagram rancang tampil rancang basis data microsoft access kembang perangkat lunak kredit bahasa program microsoft visual basic
406,dinas tenaga kerja kota bandung rupa buah instansi temu cari kerja butuh kerja tenaga kerjaperusahaan butuh tenaga kerja dinas tenaga kerja kota bandung peran informasi lowong kerja tenaga kerjaperusahaan cari kerja informasi lowong kerja maksimal rekomendasi lowong kerja ideal data milik cari kerja pasar kerja dinas tenaga kerja kota bandung nilai cocok data laku subjektif titik temu cari kerjadengan tenaga kerja usaha maksimal bantu maksimal titik temu cari kerja tenaga kerja usaha sistem dukung putus rekomendasi lowong kerja ideal sesuai data milik cari kerja metode hitung cocok data data cari kerja data lowong kerja metode profile matching garis metode laku proses banding kompetensi individu kompetensi acu beda kompetensinyanilai nilai hasil bobot nilai arti milik peluang suai kompetensi individu kompetensi acu hasil implementasi sistem aplikasi harap bantu maksimal titik temu cari kerja tenaga kerja harap tingkat anggur kota bandung
407,rama usaha gerak bidang retail rama strategi bisnis aktivitas kerja berlanggsung nilai maksimal tingkat jual usaha laku jual produk produk laku jual habis jual jual produk laku jual alam tumpuk stok produk usaha akibat kapasitas simpan lokasi gudang biaya pemiliharaan strategi pasar usaha tahan tingkat daya saing usaha salah terap costumer relationship management konsep usaha product bundling konsep usaha gabung produk paket tawar langgan hasil harap tingkat proses bisnis usaha cipta tingkat hadap puas langgan tingkat daya saing usaha usaha tingkat usaha sistem harap usaha buah bundling produk efektif efisien tingkat jual usaha
408,sistem bayar rupa sistem butuh usaha gerak bidang marketing apotek reza farma rekomendasi customer laku sistem bayar kredit apotek reza farma coba terap sistem bayar kredit terap sistem kredit apotek reza farma alam kendala apotek reza farma milik sistem olah data bayar kredit informasi data customer terima kredit olah data lapor uang rupa data transaksi kredit lunas transaksi kredit piutang lapor kena untung apotek reza farma olah data customer masuk jatuh tempo bayar tugas sales tagih atur data customer layak terima kredit langsung apotek reza farma sistem aplikasi bayar obat kredit tuju kelola data bayar kredit metode flat rate suku bunga tangan olah data customer terima kredit olah data informasi warning customer jatuh tempo olah tugas sales tagih olah data layak customer terima kredit olah data lapor uang tools sistem aplikasi borland delphi mysql metode kembang sistem metode waterfall analisa rancang sistem data flow oriented tool data flow diagram dasar hasil olah data dukung sistem aplikasi bayar obat kredit sistem bayar kredit olah data customer olah data tugas sales tagih dasar wilayah bandung bogor sukabumi cimahi cianjur olah data warning customer jatuh tempo muncul termin bayar olah data layak customer dasar bayar kredit olah data lapor uang
409,jaring adhoc rupa kumpul node wireless dinamis bentuk jaring node milik beban komunikasi libat alat dukung router access point hubung komunikasi node buah node tindak router protokol routing cari jalur jaring adhoc protokol routing jenis proactive reactive routing protocol aodv adhoc ondemand distance vector rupa reactive routing protocol geographic routing protocol rupa jenis proactive routing protocol jaring adhoc teliti tuju uji kerja routing protocol banding data dropped load delay media access network load throughput teliti batas posisi node statis immobile node alamat beban data byte teliti laku mensimulasikan kerja routing protocol software optimized network engineering tool opnet skenario skenario kirim data uji laku routing protocol milik tingkat data dropped arti routing protocol kirim data tingkat hasil routing protocol aodv banding load network load throughput routing procol aodv banding tingkat delay media access hasil masingmasing routing protocol
410,peran sistem informasi usaha hasil informasi akurat informatif date usaha usaha cvbandung design buah sistem mengintegarsikan proses bisnis usaha proses jalan proses manual media berbedabeda akibat proses bisnis efektif sistem informasi bangun konsep sistem sales distribution sistem sales distribution pilih catat aktivitas kait degan proses penjulan kendali monitor proses jual usaha kembang sistem informasi sales distribution harap bantu tingkat proses bisnis cvbandung design jalan integrasi proses bisnis buah sistem informasi proses kerja proses reporting proses analisis jual proses kerja sistem informasi
411,latar tulis skripsi kulitas layan center standar quality standard internal internal users eksternal external users aplikasi aplikasi sistem layan catat recording data produk layan program sertifikasi modulmodul training data program data fasilitator dosen asisten data transaksi layan olah processing data sistem layan saji presentation reporting informasi sistem layan aplikasi sistem layan harap mudah proses catat data produk layan program sertifkasi cepat proses olah data sistem layan mudah proses saji informasi reporting presentation aplikasi sistem layan aplikasi macromedia dreamweaver editor mysql olah basis data terap bahasa program aplikasi sistem layan sistem operasi windows browser mozilla firefox metoda kembang sistem rational unified process analisis rancang sistem metoda unified modeling language
412,game rupa media hibur minat masyarakat masuk anakanak media hibur game media ajar anak game jenis game edukasi media game edukasi proses ajar senang anak semangat ajar indonesia developer game game edukasi anak game milik grafik teliti tulis rancang bangun game edukasi nama tungtung hitung game cerita tungtung selamat temantemannya buru selamat temantemannya tungtung matematika operasi hitung bilang kali game edukasi tuju anak usia tara anak kelas sekolah dasar game bangun unity blender karakter
413,guru rupa didik selenggara didik anggota masyarakat milik akademis profesional terap kembang cipta ilmu teknologi seni didik lulus uji nasional tingkat sekolah tegah juru studi akademis guru negeri swasta ideal seteleah tempuh jalur akademis lulus gelar sarjana harap terap sektor sektor industri perintah nyata jarang jumpa calon mahasiswa sulit pilih guru referensi program studi potensi minat bakat milik teliti buah aplikasi basis buah gambar informasi kena guru program studi layan psikotest aplikasi integrasi media sosial calon mahasiswa referensi kena informasi guru calon mahasiswa rekomendasi hasil psikotest integrasi media sosial harap bantu sebar informasi guru teman media sosial tahap selesai aplikasi situs aplikasi jenis tulis laku studi literatur kena dampak psikologi akibat pilih program studi sesuai minat bakat metode minat bakat tahap kembang aplikasi tulis metode waterfall
414,game edukasi aplikasi game anakanak berisik materi didik rancang buah game interaktif tuju tingkat cerdas anakanak indonesia rupa negara pulau milik ratus pulau masingmasing pulau milik karakter georafisnya masingmasing game rancang game kena provinsiprovinsi indonesia basis android game media ajar kenal provinsiprovinsi indonesia game kuis provinsi pilih informasi tarik kena provinsi bangun game edukasi flashdevelop bahasa program actionscript metode bangun orientasi objek metodelogi addie analysis design development implementation evaluation
415,sistem pantau kualitas udara internet saji informasi kena kualitas udara ruang senyawa polutan alkohol benzena dampak buruk hadap sehat lampau batas normal perhati sumber dampak cemar udara sehat timbul khawatir salah upaya tanggulang cemar udara ukur kualitas udara kategori kualitas udara bangun sistem tuju ukur pantau kualitas udara sistem bangun development board arduino basis atmegap sensor deteksi kontaminan udara sensor ukur suhu kelembaban udara arduino ethernet shield hubung server perangkat lunak bangun bahasa arduino sistem benam phpsql bangun aplikasi lihat informasi kualitas udara situs manfaat sensor ukur kadar kontaminan udara harap bantu minimal risiko hirup udara bahaya peran server sistem informasi kualitas udara masyarakat internet efektif
416,tugas skripsi salah syarat kuliah tugas prodi milik kategori salah prodi manajemen bisnis universitas widyatama dokumen tugas laku klasifikasi dokumen utama dokumen kumpul kalimat susun sesuai bahasa manusia kuasa klasifikasi dokumen teks laku metode algoritma knearest neighbor classifier salah metode klasifikasi dokumen kelola dokumen metode text mining pengkategorian dokumen algoritma knearest neighbor classifier algoritma similarity euclidean distance minkowski distance tingkat akurasi algoritma knearest neighbour classifier algoritma similarity euclidean distance minkowski distance klasifikasi dokumen tugas lihat persentase akurasi hasil persentase akurasi dokumen abstrak data training data testing persentase data sesuai data sesuai euclidean data sesuai data sesuai minkowski
417,milu rupa proses pilih pilih orangorang isi jabatanjabatan pungut suara laku proses hitung menang milu atur main sistem menang tuju sosialisasi pilih univesitas widyatama salah laksana giat milu giat milu presma utama langsung hidup demokrasi lingkung mahasiswa utama milu mahasiswa harap mengimplimentasikan giat demokrasi jujur pilih proses olah hasil pilih sikap demokratis proses sarana dukung sikap demokratis jamin aman panitia milu butuh mahasiswa pilih kali aplikasi secure mudah disalahgunakan pihakpihak bertanggungjawab salah laku meminimalisir curang terap system autentikasi pilih handal salah terap fingerprint mahasiswa sidik jari laku proses verifikasi pilih mahasiswa pilih laku pilih sidik jari mahasiswa identifikasi manusia milik sidik jari persis solusi meminimalisir curang hemat selenggara laksana milu digital voting system fingerprint digital voting system bangun integrasi fingerprint basis base bahasa pemograman dbms mysql pemograman base integrasi aplikasi jaring milik sisi clientserver jalan webserver apache protokol webwww http dbms mysql mempunya mulithread webserver apache mysql milik lisensi general public license cumacuma hasil sistem bangun tuju jalan pilih efektif efisien metoda antisipasi curang
418,pertamina rupa badan usaha milik negara gerak bidang energi liput minyak energi jalan giat bisnis pertaminapersero depot simpan distribusi bahan bakar minyak daerah sulit proses kerja depot distribusi prioritas sistem kirim akibat kosong spbu kelola data efisien simpan data cari data batas sulit lapor data tugas metode short processing time kembang sistem jadwal metode prioritas kerja cepat selesai singkat proses kirim lambat kosong spbuserta sistem kelola simpan data lokal integrasi bantu proses kerja depot distribusi spbu daerah fitur cari lapor data data reporting butuh lapor distribusi skala dasar hasil uji kembang sistem jadwal metode short processing time dasar prioritas jarak kirim quota prioritas prioritas jarak tempuh utama banding prioritas lainnnya jarak tempuh pendek butuh kirim
419,ptlen industri persero rupa usaha bumn badan usaha milik negara gerak bidang elektronika sinyal palang pintu kereta indonesia parabola broadcasting stasiun nasional alat alat atkalat tulis kantor bantu proses kerja produksi alat laku aju kembang perangkat lunak laku proses aju metode kembang perangkat lunak waterfall unified modeling language tools alat bantu implementasi sublime text google chrome editor eksekusi program hasil teliti hasil aplikasi mudah proses aju barang atkalat tulis kantor informasi perihal distribusi barang aju barang hambat
420,mesin cari google website resmi bantu langgan informasi kena lokasi kantor kabupaten karawang batas informasi hambat lokasi kantor tuju langgan media aplikasi akses informasi cepat mudah tuju teliti aplikasi mudah langgan temu lokasi kantor kabupaten karawang bangun aplikasi gambar model sistem java bahasa pemograman oracle apiary basis data metode cari lokasi kantor haversine formula metode haversine formula rupa metode jarak titik hitung bumi buah bidang datar buah bidang milik derajat lengkung metode haversine formula hitung jarak titik garis bujur latitude garis lintang longitude mengamsusikan bumi bentuk bulat sempurna jarijari hasil teliti bangun aplikasi platform android terap metode haversine formula cari lokasi kantor aplikasi harap bantu user informasi kena lokasi kantor kabupaten karawang cepat lengkap akurat
421,usaha retail buah organisasi jual produk konsumen transaksi jual timbul tumpuk data alat analisis agam frekuensi muncul barang beli konsumen analisis market basket rupa pakai tulis menganalisa data transaksi jual temu rule item data transaksi jual atur asosiatif algoritma apriori algoritma metode analisis market basket analisis market basket cari atur asosiasi item hitung item muncul transaksi hati kuantitas item transaksi algoritma fpgrowth algoritma eclat cepat algortima apriori cari nilai confidencenya association rule item bentuk teliti kali tulis algoritma fpgrowth algoritma eclat banding lihat association rule bentuk data transaksi jual butuh cari rules nilai confidencenya batas minimal support minimal confidence hasil uji minimal support uji algoritma eclat algoritma fpgrowth butuh algoritma eclat butuh algoritma fpgrowth association rules nilai confidence algoritma eclat milik bentuk vertical butuh memori minimal support uji butuh algoritma eclat cepat butuh algoritma fpgrowth association rules nilai confidence
422,minimarket rupa jenis usaha retail swalayan skala jual produk barang makan minum pesan produk langgan kendala jarak tinggal minimarket langgan malas rumah hujan sistem pesan delivery laku telepon milik kendala langgan daftar menu harga minimarket biaya telepon teliti tuju bangun aplikasi pesan delivery informasi cepat akurat pesan produk online komputer smartphone dasar bangun aplikasi pesan minimarket metode kualitatif aplikasi bangun bahasa program mysql kelola basis data aplikasi bantu konsumen informasi produk minimarket tawar mudah konsumen proses pesan produk bantu tingkat jual usaha
423,serang denial service distribusi ddos aman perhati operator adopsi hardware khusus deteksi mitigasi serang ddos serang ddos rupa tantang deteksi dampak serang ddos software defined network sedia pusat kontrol jaring bantu pandang global jaring terap studi ekstensif ddos attacks tahap perngembangan aman jaring jaring buka lebar teliti salah dampak serang ddos hadap jaring tingkat kompleks dampak negatif skala luas teliti tulis usul kerangka kerja mitigasi serang ddos hadap jaring algoritma flowtrapp laku deteksi mitigasi batas traffic bandwith dasar alir parameter flow rate flow duration traffic algoritma flowtrapp implementasi mininet emulator sflowrt deteksi serang floodlight contoroller uji hasil performa algoritma flowtrapp hasil teliti ukur performa algoritma flowtrapp algoritma flowtrapp serang
424,kembang teknologi dukung butuh masuk anakanak usia dewasa pesat kembang aplikasi game basis android main fungsi hibur alat ajar umur didik utama sistem didik aksara bahasa sunda perhati teknologi sarana bantu fasilitas proses ajar aksara sunda bimbing main ajar game interaktif bantu proses aksara sunda salah media ajar interaktif umurmetode bangun perangkat lunak metode screenplay unified modeling language model perangkat lunak game interaktif unity bahasa javascript terap sistem smartphone basis android aplikasi game ajar interaktif aksara sunda basis android user alam ajar aksara sunda mediamedia ajar
425,sistem aman sistem operasi windows hindar halhal harap ubah konfigurasi setting sistem operasi windows otomatis ubah nilainilai registry windows akibat fatal sistem operasi windows aplikasi security microsoft windows rancang mudah administrator kunci fungsi windows file executable aplikasi sembunyi drives anggap simpan data proses bangun aplikasi kembang metoda prototype tahap analisis rancang rancang struktur aplikasi security microsoft windows rancang programming tool borland delphi
426,hidroponik rupa metode cocok tanam solusi batas lahan kebun metode hidrogen konduktifitas elektrik parameter nutrisi nilai pantau jaga hasil tanam optimal teliti terap teknologi internet things dukung kembang smart farming system kebun hidroponik nilai nutrisi media tanam akuisisi sensor konduktifitas elektrik integrasi buah perangkat monitoring kontrol hidroponik data kirim tuju aplikasi hydroponic monitoring system pasang server modul komunikasi ethernet shield protokol komunikasi hypertext transfer protocol aplikasi hydroponic monitoring system akses internet aplikasi laku pantau nutrisi dasar data parameter terima perangkat monitoring kontrol nilai kontrol aplikasi perangkat nilai kontrol aplikasi proses pupuk asam otomatis suai butuh tanam
427,text summarization buah proses hasil summary ringkas artikel milik gambar akurat artikel text summarization seringkali hasil hasil ringkas redundan katakata makna ganda ambigu word sense disambiguation proses mengindentifikasi makna kalimat milik makna beda sistem implementasi metode lexical chain with word sense disambiguation rupa kembang metode lexical chain lexical chain rupa salah metode text summarization bentuk rantai leksikal dasar hubung semantik teks metode lexical chain rantai leksikal bentuk akurat ambigu milik makna ganda metode lexical chain gabung metode word sense disambiguation lesk algorithm knowledge source wordnet bantu hilang ambiguitas bentuk rantai leksikal hasil uji laku tugas terap word sense disambiguation metode lexical chain hasil ringkas hasil alam tingkat performansi banding metode original lexical chain terap metode word sense disambiguation algoritma lesk bantu metode lexical chain bentuk rantai leksikal hilang ambiguitas candidate term bentuk rantai leksikal minimal tingkat redundansi pilih kalimat hasil ringkas
428,minat baca indonesia salah media baca pustaka toko buku media online baca tulis konten baca media online khusus baca tulis konten media online sedia fitur saran baca metode rekomendasi rupa metode saran sesuai salah algoritma apriori rupa metode rekomendasi algoritma apriori saing teknikteknik efisien fpgrowth algoritma apriori anggap algoritma mapan algoritma tangan data sederhana bidang implementasi algoritma apriori rekomendasi optimal salah contoh selesai algoritma apriori rekomendasi baca suka tuju algoritma apriori saran baca suka baca saran baca konten rupa harap alas saran baca konten tingkat minat baca hasil rekomendasi timbang konten baca
429,intensitas curah hujan timbul akibat bencana banjir longsor teliti lihat peluang lahir buah teknologi butuh cari pola data data mining data mining proses gali nilai rupa informasi manual milik fungsi salah classification fungsi data mining milik algoritma teliti tulis algoritma multilayer perceptron prediksi curah hujan kota bandung algoritma pakai milik deteksi laku analisa kompleks metode laku proses prediksi curah hujan multilayer perceptron metode bangun perangkat lunak prototyping unified modeling language tools alat bantu implementasi microsoft visual studio editor eksekusi program hasil teliti tools prediksi curah hujan masuk validasi curah hujan aplikasi hasil tingkat akurasi prediksi curah hujan stasiun geofisika kelas bandung data laku data latih uji
430,twitter rupa sosial media gemar sebar informasi cepat informasi edar berita opini komentar kritik sifat positif negatif netral data lansir statista dasar hasil teliti peerreach indonesia masuk twitter aktif dunia amerika serikat jepang twitter salah media sosial bandung kota bandung kota peringkat dunia twitter kumpul data laku analisis sentimen hadap lihat respon masyarakat hadap objek teliti analisis sentimen laku klasifikasi buah tweet kelas sentimen positif netral negatif proses kumpul data pilih fitur proses klasifikasi metode teliti analisis sentimen lexicon based opinion lexicon milik terjemah bahasa indonesia na ve bayes classifier dasar james hennessey teliti laku skenario hubung text preprocessing feature selection kunci teliti ridwankamil tweet label manual kelas positif netral negatif hasil teliti nilai akurasi hasil terap skenario uji tahap text preprocessing feature selection
431,jaring sosial populer hubung orangorang dunia info berkas foto video platform sosial media mitra bisnis signifikan prihatin orangorang bertanggungjawab serang akun kumpul data informasi mata uang virtual peristiwa efektif akibat rugi finansial salah tantang aman jaring perhati utama spam rugi resah muncul identitas asli palsu manusia teknik ajar mesin temu halhal pertanyaanpertanyaan teliti bahas sistem metode program capai tuju integrasi sistematis deteksi fiturfitur ciri akun dasar postingan dasar tulis laku deteksi bots dasar metode random forest machine learning ajar mesin terap teknik filtering saring laku rules atur supervised machine learning spam filtering machine learning menganalisa nilai saring email spam dasar sumber pesan teliti hasil deteksi akun spam machine learning tweet data dicrawling temu tweet prediksi spam account prediksi account prediksi spam implementasi teknik random forest supervised machine learning teliti akurat akurasi temu akun spam
432,karyawan rupa buah aset harga buah usaha sentiment berubahubah bebagai faktor karyawan tindak usaha interaksi karyawan karna dibutuhkanya buah sistem emosi karyawan kerja text mining acu proses ambil informasi kualitas teks informasi kualitas ramal pola cenderung sarana ajar pola statistik naive bayes clasification integrasi tfidf dukung text mining ambil putus sentiment analiys dasar text social media integrasi sistem text mining naive bayes hasil tingkat akurat text bahasa indonesia emosi user tingkat akurat aplikasi megetahui emosi jalin hubung lingkung kantor
433,salah proses jual barang prediksi barang prediksi overstock barang sedia untung maksimal prediksi barang jual laku ajar data jual periode prediksi barang teknik kembang kelompok metode metode kualitatif metode kuantitatif metode masuk metode kuantitatif metode arima autoregressive integreated moving average single exponential smoothing metode rupa metode cocok prediksi jangka pendek prediksi teliti sutrisno wijaya hasil nilai akurasi metode arima metode single exponential smoothing metode arima model penuh abai independen variable ramal nilai hasil ramal jangka pendek metode autoregressive moving average gabung autoregressive moving average arima single exponential smoothing buah metode halus data bobot parameter halus alpha proses hitung metode prediksi nilai dasar periode aplikasi bangun hasil nilai output prediksi jual parameter input data jual hasil uji aplikasi laku metode arima banding single exponential smoothing data surya sahabat utama data uji data sepeda motor hasil metode arima metode error hasil metode autoregressive arima type sepeda motor satria maret
