,abstract
0,segmentasi langgan dasar target bagianbagian langgan minimal biaya pesan tingkat profitabilitas metode laku kelompok langgan langgan nilai profitabilitas hadap usaha transaksi laku segmentasi langgan teknik data mining clustering buah putus bisnis efektif strategi bisnis segmen teliti teknik hierarchical clustering kelompok data metode agglomerative hierarchical clustering proses hasil analisis metode hasil kelompok langgan orang langgan masuk kelompok data teliti data transaksi retail data data jupyter notebook tools implementasi metode bahasa python olah data presentasi data teliti rupa segmentasi langgan tampil visualisasi grafik gambar perilaku bisnis langgan segmentasi langgan hasil kelompok kelompok kelompok dasar data transaksi
1,dukung teknologi telehealth kembang proses periksa kondisi sehat batas giat telehealth butuh utama pasien sulit jangkau tenaga sehat teknologi telehealth indonesia tunjang periksa fisik mandiri khusus pasien milik sakit jantung pantau sehat jantung dasar suara selesai stetoskop elektronik bahas teliti stetoskop elektronik bangun integrasi stetoskop akustik audio mikrokontroler microphone mikrofon kartu simpan memori simpan berkas hasil rekam suara jantung stetoskop elektronik rekam suara jantung riwayat kembang kondisi jantung dasar suara proses telehealth
2,otomotif rupa hobi gemar masyarakat indonesia khusus hobi kendara sepeda motor koleksi varian merek harley davidson bikers laku rombak motor harley davidson ragam rombak laku penuh selera hati lahir bermacammacam gaya alir modifikasi kembang ringan berat jenis jenis alir modifikasi stock custom dresser streetster tech custom full custom chopper extrem chopper hardcore psycodelic tuju capai tugas aplikasi simulasi modifikasi sepeda motor interaktif basis multimedia laksana modifikasi cepat selesai biaya aplikasi simulasi bantu milik harley davidson laksana modifikasi pilih komponen spesifikasi aplikasi teknologi informatika terap teknologi virtual data base teknologi macromedia flash tampil grafis interface pakai windows basis sistem operasi jalan aplikasi
3,sedia inventory rupa bahan baku simpan usaha penuh langgan hadap sedia barang tumpuk gudang barang milik kadaluwarsa kadaluwarsa barang barang layak jual dampak usaha alam rugi nusantara motor bandung rupa usaha gerak bidang otomotif layan jasa rawat laku jual suku cadang kendara roda nusantara motor bandung milik stok suku cadang dasar hasil teliti suku cadang fast moving slow moving pasar milik kadaluarsa proses jual sedia barang habis habis selesai kembang sistem inventory sistem inventory menu kelola data stok barang purchase request purchase order sales order lapor datadata kait jual suku cadang stok barang metode fifo firstin firstout dasar tanggal terima barang gudang metode fifo rupa metode catat sedia asumsi sedia masuk jual sedia masuk hindar suku cadang fast moving slow moving kadaluwarsa
4,jaring rupa jaring telekomunikasi cepat gelombang radio transmisi data user gelombang radio transmisi data gantung bandwidth tersediaterbatasnya bandwidth digunakanmengakibatkan butuh algoritma jadwal packet schedulerpacket scheduler fungsi jadwal kirim data gelombang radio dasar nilai putus hasil algoritma packet scheduler nilai metric teliti jenisalgoritma packet scheduler uji maxthroughput proportional fair rupa packet scheduler jenis channelaware volte rupa layan suara jaring tuntut milik nilai standar kualitas layan suara mean opinion score teliti tuju uji kerja packet scheduler maxthroughput proportional fairdengan banding throughput packet loss ratio delay fairness spectral efficiency teliti batas cell variasi user cepat gerak user jenis trafik data voip trafik data video banding ukur byte byte teliti laku mensimulasikan kerja packet scheduler software ltesim release dukung bahasa hasil teliti packet scheduler maxthroughput packet scheduler proportional fair banding throughput spectral efficiency packet scheduler proportional fair packet scheduler maxthroughput banding packet loss ratio delay fairness packet scheduler proportional fair penuh standar kualitas volte packet scheduler maxthroughputtidak penuh standar kualitas volte
5,extract transform load buah jembatan bangun buah data warehouse tanggung ekstraksi data sumber data pisah integrasi pasu data warehouse proses rupa salah tugas bangun buah data warehouse rancang bangun proses rancang bangun transformasi data warehouse laku tahap analisis laksana rancang bangun potensi hasil data warehouse cepat akurat bangun data warehouse butuh fokus paham bidang utama bidang data sumber bidang data tuju bidang peta universitas widyatama salah universitas favorit bandung bangun buah data warehouse desak butuh data dashboard tampil data sumber data akademik uang bahasa pemograman hypertext preprocessor database mysql dashboard tampil chart durasi bangun schedule proses tools laku proses schedule pentaho data integration bangun data warehouse datadata sumber integrasi proses query mudah hasil informasi lihat aplikasi dashboard proses transformasi bangun data warehouse salah informasi proses lapor pimpin universitas sistem ambil putus borang akreditasi
6,media ajar rupa buah proses didik orang khusus didik laku orang anak bukti media ajar media ajar bentuk cetak aplikasi desktop seringkali sifat monoton alam batas akses kembang teknologi informasi manfaat media ajar cocok anak sedia akses luas media ajar gabung teknologi flash animatif sedia akses luas media ajar anak ajar ajar huruf hijaiyah ajar doadoa kerja kuis selesai kuis nilai soalsoal kuis ambil materi ajar media ajar kuis tuju tolak ukur tingkat kefahaman hadap materi ajar media ajar bangun media ajar anak metode kembang perangkat lunak model waterfall tahap analisa metodologi orientasi alir data data flow diagram aplikasi bangun perangkat lunak utama adobe flash adobe dreamwaver perangkat lunak dukung xampp sever mozilla firefox browser program basis data mysql bahasa program mengkoneksikan aplikasi basisdata
7,indonesia rupa bangsa kaya keanekaragaman budaya indonesia suku provinsi bentuk republik indonesia masingmasing daerah indonesia milik seni budaya berbedabeda unik ciri khas daerah masuk budaya asing indonesia rendah kenal budaya masyarakat utama anak sekolah faktor peduli masyarakat hadap budaya indonesia kenal budaya anakanak laku kenal budaya terap sekolah mata ajar seni budaya proses ajar terap buku anak anak baca anakanak cenderung suka halhal sangkut teknologi anakanak suka anggap tarik baca buku proses kenal budaya terap beda anak anak masyarakat tarik mempelejarinya bangun aplikasi teliti terap augmented reality kenal budaya indonesia hasil harap bangun aplikasi masyarakat khusus anakanak mudah ajar budaya indonesia tingkat lupa budaya indonesia
8,algoritma rinjdael rupa algoritma kriptografi menang sayembara buka adakan nist national institute standarts technology pilih ganti algoritma kriptografi data encryption standard anggap aman kunci relatif pendek mudah pecah alam proses sempurna nist rijndael standard algoritma kriptografi kenal advanced encryption standard tuju aman data file milik akses data file teliti bahas salah bentuk kriptografi kriptografi algoritma rinjdael laku banding performansi algoritma twofish tangguh algoritma masingmasing implementasi bahasa pemograman microsoft visual basic
9,location based servicelbs tuju letak mudah user cari lokasi tuju kembang teknologi informasi salah telepon genggam kembang aplikasi mudah aplikasi sistem operasi android kenal sistem operasi buka bantu kembang aplikasi terap sistem operasi android terap spbu mudah jalan cari lokasi spbu utama wisatawan lokal kunjung kota bandung dasar laku teliti implementasi location based service sistem operasi android cari spbu wilayah bandung teliti aplikasi bahasa java eclips rupa android developer tools metode kembang perangkat lunak metode prototype hasil uji teliti location based service cari lokasi spbu wilayah bandung milik rincian fasilitas spbu cari spbu laku pasu alamat spbu tuju lihat langsung peta sedia cari dasar lokasi user fitur perangkat android gpsglobal positioning system dukung google maps
10,globalisasi kembang teknologi informasi pesat informasiinformasi butuh utama individu organisasi sistem aman informasi jaga informasi potensi negative sadap curi rusak data pihakpihak informasi data kirim pertamatama sandi enkripsi pesan bentuk sandi bentuk data asli deskripsi baca terima seni sandi kriptografi metode algoritma rivest shamir adleman rupa salah metode kriptografi rekomendasi bangun sistem aman konsep asimetris algoritma kunci beda proses enkripsi deskripsi metode hasil sistem aman sulit sadap banding metode data encryption system metode pilih metode efektif konsumsi enkripsi memory resources metode pilih banding metode advanced encryption system metode potensi serang attack tulis tarik bangun sistem aman mengkombinasikan masingmasing metode teliti tulis bangun sistem aman bahasa program dasar timbang aktivitas situs dinamis teliti harap salah urgensi butuh sistem aman website
11,teknologi informasi jamur timbul saing dorong inovasi tahan eksistensi kembang usaha analisis pola selera konsumen perhati usaha utama industri sedia bahan pokok makan kembang industry sedia bahan pokok makan lepas puas nyaman konsumen hadap industry distributor mart rupa salah industri sedia bahan makan layan tingkat saing ketat industry distributor mart hati butuh konsumen langsung pengaruh hadap opsi konsumen pilih penuh butuh tugas tulis metode apriori gali pola hubung atributatribut frequent itemsets transaksi laku konsumen hasil metode nilai support nilai confidence rekomendasi pola selera konsumen support confidence algoritma apriori terap metode apriori acu management distributor mart strategi pasar acu rekomendasi pola selera konsumen hasil
12,dokumen berita ukur sulit baca baca serap informasi teks ringkas teks otomatis rupa salah informasi cepat relevan ringkas teks otomatis teknik ekstraksi milik proses ringkas kalimatkalimat buah dokumen salah puluh fitur ekstraksi teks teliti bobot puluh fitur ekstraksi teks teliti laku zulkifli puluh fitur ekstraksi teks algoritma genetika hasil akurasi harap teliti bobot puluh fitur ekstraksi hasil akurasi metodologi teliti liput studi literatur analisis implementasi uji analisis hasil simpul studi literatur laku paham kait ringkas teks otomatis metode jaring syaraf tiru susun teliti rupa buku jurnal artikel laku analisis butuh sistem tuju laku model dasar metode tahap program hitung skor kalimat dasar fitur ekstraksi terap algoritma jaring syaraf tiru rancang update nilai bobot laku uji hadap sistem bangun laku hitung nilai precision recall fmeasure banding hasil ringkas sistem hasil ringkas ahli tahap tarik simpul sesuai hasil metode jaring syaraf tiru implementasi bangun sistem ringkas teks otomatis multidokumen mengunakan puluh fitur ekstraksi ringkas teks bahasa indonesia teliti hasil uji hasil akurasi dasar hasil coba laku performansi akurasi data latih
13,aplikasi platform android khusus bantu kembang ajar anak aplikasi aplikasi kenal huruf angka warna bentuk binatang hapalan sedia ajar baca tanda aplikasi mari kenal buah aplikasi didik isi ajar kenal baca anakanak kenal bentuk baca aplikasi lengkap narasi dukung bantu anakanak lancar baca materi saji gambar sound narasi animasi anakanak selesai ajar main games edukatif uji aplikasi basis android adobe flash
14,butuh masyarakat hadap informasi internet dorong pilih konsumen pilih layan internet salah telkom sedia layan indihome optical distribution point titik koordinat rumah langgan jalur jalur pendek hasil jarak optimal teliti tulis metode particle swarm optimization metode jalur pendek capai destinasi tuju singkat rupa metode cari solusi cepat banding metode algoritma genetika proses algoritma particle swarm optimization bangkit populasi bangkit velocity evaluasi personal best global best update velocity update populasi evaluasi update personal best update global best terap local search cari solusi daerah global best dasar hasil uji laku sistem hasil jalur total jarak optimal algoritma particle swarm optimization uji laku banding parameter beda lihat pengaruh particle count epoch hadap total jarak nilai uji epoch jarak optimal
15,twitter rupa wadah utara tanggap hadap barang buah status tweet tanggap rupa tanggap positif negatif pengaruh orang media sosial twitter picu peluang laku analysis sentiment opinion mining respon tanggap orang hadap manfaat proses ambil putus teliti analisis sentimen laku klasifikasi tweet kelas sentimen positif kelas negatif tahap text preprcessing feature selection proses klasifikasi metode analisis sentimen metode lexicon based opinion lexicon milik metode knearest neighbor teliti laku skenario hubung proses text preprocessing feature selection corpus rupa kumpul tweet twitter kena jenis hotel hyatt marriot data tweet label manual kelas positif negatif hasil uji skenario nilai akurasi metode lexicon based hotel hyatt hotel marriot nilai akurasi metode knearest neighbor
16,peran teknologi informasi hadap ambil putus kait strategi giat bisnis capai tuju rupa bukti kembang teknologi kembang pesat tingkat daya saing usaha tuntut pantau proses jual dasar jual produk bloods industries alam tingkat manajemen alam sulit kelola lapor data jual butuh struktur simpan data efisiensi kelola analisis dukung ambil putus cepat hambat salah laku data warehouse hasil teliti buah data warehouse cakup aplikasi terap multidimensional modeling data warehouse bangun dasar metode olap online analytical processing tampil star schema design hasil informasi analis kena data jual bantu usaha ambil putus efisien
17,member rewards jenis layan member hardware indonesia customer hardware indonesia layan membernya laku registrasi member rewards laku manual proses pengiputan data sistem laku customer service customer member rewards indonesia laku ecek poin hasil belanja poin sulit customer customer store hardware customer service member rewards alam sulit lihat poin dasar hasil transaksi hardware indonesia laku kerjasama merchant hotelhotel wisata caf indonesia customer member rewards indonesia diskon khusus informasi untung member rewards indonesia customer hardware indonesia kembang sistem customer relationship management member rewards selesai hadap meningkatakan loyalitas customer rancang kembang sistem customer relationship management member rewards metodologi kembang sistem software development life cycle sdlc metode waterfall data flow diagram rancang tabeltabel relasi database entity relationship management implementasi kembang sistem bahasa program mysql kembang sistem customer relationship management member rewards fasilitas lihat masuk ubah kelola data member data konfirmasi bayar customer care history poin informasi transaksi promo merchant kuis
18,sistem manajemen karir rupa salah sistem indonesia persero sistem manajemen karir isi atur atur karyawan atur grade kelompok jabat personal value proses mutasi sistem manajemen karir belah karyawan usaha karyawan sistem harap acu standar kembang karir kerja usaha maksud mudah atur bisnis proses karyawan sistem indonesia persero laku manual atur grade kelompok jabat personal value rekomendasi calon karyawan proses rekomendasi calon karyawan mutasi objektifitas calon karyawan cakap pegawai maksimal buah perangkat lunak alternatif solusi kendala kerja indonesia persero utama kembang karir bang karir rancang sistem capai giat efektif efisien tunjang aktifitas usaha kembang aplikasi sistem manajemen karir rancang dasar metode waterfall rupa implementasi metode kembang perangkat lunak system development life cycle sdlc model konsep kembang aplikasi dasar metode diagram alir data aplikasi sistem manajemen karir aplikasi hypertext processor akses database aplikasi perangkat lunak mysql lapor tugas implementasi indonesia persero utama divisi sumber daya manusia kembang karir bang karir indonesia persero bangun perangkat lunak harap bantu proses atur sistem manajemen karir bantu kelola rekomendasi calon karyawan mutasi laku divisi sumber daya manusia kembang karir bang karir indonesia persero
19,manfaat teknologi informasi proses bisnis akumulasi data salah organisasi manfaat teknologi informasi universitas widyatama akumulasi data bantu transformasi data informasi terap data mining engine data mining engine bangun metode regresi linier tuju gali temu polapola sembunyi data nilai uji saring masuk data indeks prestasi sehiingga informasi hasil dasar analisis ambil putus nilai database bangun data mining engine bangun aplikasi microsoft visual studio aplikasi interface system olah basis data microsoft server data mining engine system operasi microsoft windows microsoft windows server familiar laku teliti nilai pengaruh persentase data sampel data populasi simpul nilai hadap nilai milik hubung erat
20,sarana informasi bantu selesai kerja komputer salah media hibur tarik main game game rupa media hibur minat masyarakat main game salah pilih hibur favorit jenuh stres media hibur game batu ajar anak game jenis game edukasi proses ajar senang media game edukasi anak semangat ajar didik khusus bahasa asing bahasa inggris susah dipelajarai teknologi manfaat salah sarana batu proses ajar bahasa inggris pandu anakanak main ajar game mobil jalan mobil jalan timer mengitung mundur timer point user timer habis user salah mobil langsung ledak game over game edukasi tuju anakanak sekolah game dibangung unity
21,iring kembang jaman manusia alat serba canggih utama bidang teknologi informasi kembang teknologi informasi ubah dunia serba mudah berkat dukung teknologi komputer bukti mekanisme kerja efektif efisien cari apotek sedia obat butuh masyarakat apotek sesuai cari butuh obat sistem informasi sedia data obat butuh sesuai kriteria salah kriteria jarak tuju lokasi apotek faktor jarak teliti rupa timba masyarakat jarak masuk parameter cari sedia data obat apotek sistem bangun basis bahasa framework laravel selesai bangun sistem laku cari apotek lokasi current location tampil sedia data obat apotek solusi wujud data latitude longitude haversine formula rupa buah jarak linkaran radius titik muka bola bumi dasar garis bujur lintang haversine formula rusum hitung jarak titik inputan latitude longitude titik hitung jarak titiktitik
22,cerdas visualspasial salah jenis cerdas teori multiple intelligences utara kali howard gardner cerdas visualspasial rupa jenis cerdas menitikberatkan lihat dunia visual spasial akurat software main interaktif anak usia eksplorasi latih cerdas visualspasial rupa aplikasi eksplorasi cerdas visualspasial anak usia main sarana ajar bentuk main didik rumah aplikasi bangun program adobe flash bahasa program actionscript interface coding system bangun kembang perangkat lunak tool unified modeling language aplikasi manfaat tumbuh kembang cerdas anak usia utama cerdas visualspasial aplikasi manfaat orang cerdas anak milik rujuk ambil langkah kembang cerdas milik anak
23,kembang teknologi informasi pesat dampak pola ajar alam ubah materi laku media media maksud komputer program software komputer proses ajar labih efektif efisien aplikasi media interaktif salah jenis software bantu proses ajar visualisasi respon buah aplikasi interaktif bantu paham materi aplikasi ajar kenal objek tarik perhati anak sesuai minat butuh anak buku praktis kenal objek dasar gambar buku ajar mengunakan media buku nampaknya sulit bosan salah tarik perhati anak bantu ajar kenal obyek lagu media interaktif animasi audio visual meruapakan hasil integrasi unsur animasi kartun lagu bebasis teknologi perangkat lunak adobe flash saji obyek dasar lagu anak nyanyi aplikasi ajar multimedia interaktif harap media bantu alternatif sistem ajar proses ajar ajar
24,studi telusur alumni laksana jaring informasi alumni salah evaluasi kembang universitas widyatama studi telusur informasi alumni rupa salah komponen nilai akreditasi studi telusur alumni universitas widyatama manual form kumpul data telusur informasi telepon sistem manual biaya data alumni kumpul baharu mudah tugas sulit informasi alumni bangun sistem basis integrasi sosial media email interaksi form media kumpul data telepon telusur informasi alumni terap metode tracer study laku harap makan biaya data alumni baharu mudah telusur informasi terkaiy informasi kena alumni sistem bangun mudah giat kumpul data alumni telusur informasi alumni tingkat nilai efektifitas capai tuju efisiensi sumber daya biaya sistem baharu informasi alumni integrasi media sosial facebook email luas sebar informasi mudah telusur sasar
25,sistem verifikasi hadir jayamandiri gemasejati rupa salah sistem usaha sistem verifikasi hadir usaha kerja karyawan sesuai atur laku rfid rupa salah solusi laku verifikasi hadir rfid milik harga relative murah banding fingerscan sistem rfid tanggulang sulit verifikasi hadir khusus teknisi usaha kerja berat jari teknisi luka kotor akibat fingerprint baca monitoring hadir karyawan usaha laku monitoring cepat pimpin karyawan laku verifikasi hadir sesuai atur hadap karyawan laku jalan dinas kantor cabang verifikasi hadir laku monitoring hadap karyawan laku jalan dinas karyawan laku jalan dinas karyawan karyawan laku jalan dinas laku kerja sistem laku jalan dinas sistem laku catat hadir karenan sistem simpan data fingerprint karyawan kantor cabang masingmasing tugas tulis laku kembang sistem verifikasi hadir rfid teknologi pimpin laku monitoring hadir karyawan
26,usaha cemara agung produksi kain pabrik sulit lapor kena sistem produksi produksi kain laku hasil kain hasil faktor pengaruh hasil produksi kain cacat kain human error sistem tampil lapor produksi utama kena cacat kain sistem rancang rupa buah dashboard basis akses awai cemara agung sangkut produksi kain pabrik hasil rancang sistem rupa grafik dashboard business intelligence berisik informasi kena lapor produksi kain cacat kain prediksi cacat kain implementasi dashboard business intelligence proses saji analisis lapor sistem produksi kena produksi kain cacat kain optimal akses
27,usaha instansi kait terap sistem nilai kerja karyawan manfaat teknologi informasi turun semangat kerja karyawan fasilitas bantu motivasi karyawan kerja program clustering nilai kerja karyawan apresiasi kerja reward karyawan kerja konsisten loyal buah perangkat lunak analisis performansi kerja karyawan metode fuzzy cmeans clustering terap usaha basis evaluasi karyawan data karyawan promosi maju karir objektif cermat teliti teliti metode fuzzy cmeans clustering teknik pengclusteran data tiaptiap data cluster nilai anggota fuzzy cmeans teknik clustering kelompok data titiktitik data cluster derajat anggota dasar hasil implementasi hasil quesioner isi manajer ambil simpul aplikasi analisis kerja performansi karyawan nyata manfaat usaha nilai kerja karyawan basis teknologi point tuju penuh desain interface program nyaman component anggap menu program jalan sesuai fungsi tuju penuh butuh kelola sumber daya manusia usaha
28,luap sungai tahan debit salah faktor banjir akibat rugi hadap masyarakat tugas pintu siang malam tugas catat debit elemen salur informasi kait status pintu masyarakat batas tugas pintu orang manusia pantau siang malam informasi kena masyarakat batas media informasi informasi kait status pintu masyarakat langsung masyarakat antisipasi banjir teliti tugas laku bangun early warning sistem basis ukur pintu sensor ultrasonik arduino mikrokontroler hubung perangkat keras sistem kirim pesan singkat masyarakat status pintu ubah status masyarakat daftar kirim pesan registrasi sistem masuk data nomor telepon sangkut langsung sistem tugas pintu pantau status pintu sistem langsung
29,jadwal tera ulang kalibrasi balai metrologi bogor rupa salah uptd dinas industri dagang provinsi jawa barat balai metrologi bogor milik luas wilayah kerja luas milik spbu timbul muncul pantau hadap giat proses tera ulang kalibrasi liput batas tugas ahli tata sesuai standar laku batas standar takar sistem jadwal scheduling laku manual milik kendala hilang data lambat akibat laku tera ulang merugiakan metrologi spbu teliti tuju bangun aplikasi jadwal scheduling data spbu jadwal diteraulang kalibrasi cepat akurat curang data benaroleh bangun aplikasi metrologi mudah informasi batas spbu sistem aplikasi bantu kendala muncul jadwal tulis coba teliti judul aplikasi jadwal tera ulang kalibrasi studi balai metrologi bogor harap sistem solusi maju metrologi
30,agam jahat dunia digital masyarakat batasanbatasan hukum dunia digital dampak tingkat bentuk tindak jahat digital jahat digital salah sebar konten sifat hina leceh orang lembaga metode identifikasi laku selidik metode generic computer forensic investigation model gcfim tools imager osorensics recuva dukung sidik laku cari barang bukti digital barang bukti data hilang temu recovery tools imager recuva osforensics beda hasil tools dasar hasil uji presentase hasil recovey data imager recuva osforensics tools dasar hasil uji recovery data recuva butuh tools dukung laku imaging data imager osforensics
31,indonesia milik pariwisata bagus tarik wisatawan kunjung salah sumatera barat kenal indah alam pantainyauntuk bantu wisatawan pilih wisata tuju aplikasi mudah wisatawan cari dasar kriteria inputkan teliti metode fuzzy database model tahan referensi wisata kunjung sumatera barat metode fuzzy tahan wisatawan mudah cari wisata kunjung sesuai kriteria pilih rancang aplikasi unified modeling language bahasa model bangun sistem bangun tahap implementasi bahasa program basis data database mysql rencana uji aplikasi basis teknik black hasil implementasi aplikasi jalan wisata sumatera barat milik fitur cari wisata dasar kriteria eventevent selenggara sumatera barat forum informasi sesame wisatawan
